,sentence1,sentence2,label
1123,", third in, has died at the of 100 . died of natural on , 22 , 2009 at an assisted in, . He was moved there after his deteriorated a ago . His said that when admitted, refused to eat solid and would only drink .``He just refused to eat and that was his ,""told the . He added that his was``sharp up until four ago"".",died in at the of 100.,0
1124,"Canadian also are reported to drop their loads across the in remote (often without the of rural), into the without, later retrieve the, and continue on to.",Most of the entering the comes from.,1
1125,"said the 5.3 did not generate a . The 2004 Indian, which had a of 9.0, triggered a of lethal on 26 , 2004 that killed over 270,000, making it the deadliest in recorded.",A is a of created when a of rapidly displaced on a massive.,1
1126,"In 1969, he drew up the proposing the from the of the . In 1984, after's, was elected as.",supported the.,1
1127,", the of died at 59 . He died in a in . His was intially announced by an anonymous . It was later confirmed on by . suffered a while in in of this for an, he was flown to . His suddenly deteriorated on.",The Zambian has ordered to.,1
1128,"revealed he was one of several top who told in 2003 that, of the former, worked for the.",worked for.,1
1129,"In to, the memorial was attended by and who have worked with, including who starred with in the bio-flick, I'm Not There . spoke of the she shared with in and . The Other included his, and, a of's last Australian, . An emotional, was wearing dark and a white with black, she was not accompanied by her . walked in clutching the of's older ,.",has a called.,0
1130,"The first few are 3 , 7 , 31 , 127 and 8191 . These took a of several to verify, using different and . Each was independently checked by several of', using 16-core of different . The two were announced by on 16 . Before these two, the two previously largest known prime were discovered by and in, , and their lasted almost three . Historically, prime discovered by are larger than the one previously found . The only other was when the 29th was discovered after the 30th and 31st were found . Founded by . in 1996, has found 12, or about one per on.",is a of.,1
1131,", the, said, last, that his were``playing out of their"", but admitted that they were``racing against""to track down the.",works for the.,0
1132,"The renewed to the came as, camping near the's, awaited a by.","brought her latest anti-war to's adopted, supporting camping out near his.",1
1133,"The failed to act on the domestic from al prior to 11 , 2001.",ignored the of,0
1134,"have uncovered soft of a known as 1125, found in a in . 1125 was 18 old when it died , 65 million ago . Similar of a has never been found before, as all remains found until now were fosilized . The still contains microscopic resembling and . The between the found in the and a modern shows a remarkable . The have been duplicated with an 80-million-year-old and two other . The was reported in's of . similar to the popular ``""are unlikely, as the of from the is improbable . The remain astounding, however, and with that react to collagen shows the may still contain .``Ultimately if we could establish chemical, we would have into all of: , sexual, whether the is the or . ``, paleontologist said.",Paleontologist and other discovered a in.,1
1135,"A male escaped from his in the and sent terrified running for, the said.",A escaped from his in a in.,0
1136,"Two were injured in dynamite perpetrated this evening against two in this northwestern, Colombian.",Two were attacked with.,0
1137,"An, employed by the, was also wounded.",An worked for.,1
1138,The most recent carried out by in revealed that 61 of are opposed to joining the.,The of the has been opposed.,0
1139,"The's came about after it set out to examine's that an octagonal in the of the of contained the of . According to texts the, in what is now, is where was banished after being defeated in a against and her then, . was said to have been murdered after, now with following's, ordered the to have her younger sibling killed to prevent any future on the Egyptian.",Queen ordered the of her.,0
1140,Every jails simply because they refuse to perform military for of.,are willing to risk rather than perform military.,0
1141,"After the touched down, the () alerted and the transmitted ``, ,""to the in an to stop the of runway 1L . The applied maximum that resulted in the in the of 1L . As this was occurring, the of 4912 took of the from the first, realized the was traveling too fast to stop, and initiated an immediate . According to the of 5741, the overflew theirs by 30 to 50 . The has categorized the as an operational.",is responsible for investigating in the.,1
1142,The of & will take another at's increased.,tries to take over &.,0
1143,"A strong of the``Italian to"", he was close to, and gained a in the . In 1969, he drew up the proposing the from the of the . In 1984, after's, was elected as.",supported Italian.,0
1144,"After insulting the insinuating they were irrelavant, no had from to use``force/war""if did not permit unfettered for - and the were moved into on the.",gives unfettered.,1
1145,His has steadfastly denied the.,The were denied by his.,0
1146,"His latest, Together Through, has reached the top 38 and five after his last chart-topper, , in 1970 . The 67-year-old American now holds the for the longest between solo one . It is's seventh one, his 33rd and his 53rd, including and . He first reached one with The' released in 1964 .'s said:``It's evident that is going through one of his, as a new of join his more established in appreciating his musical . ''",is 67 old.,1
1147,"The was never drawn up on, but discussed verbally, particularly between and the British in.",was the in.,1
1148,"also released a where a humanoid named was operated by a wearing the . The was stated to be thinking about raising his right, after which moved its right . states that it could be quite some before the is ready to go live due to such as the human's to become distracted, creating mixed . A related is the of required by the .``Practical are still into the .""said, .``I'm [just] talking about . ''",is an of.,0
1149,"The working together with nearly 960 other recently concluded a week-long, , which succeeded in the of 10,340 across the and elsewhere . Other regional have been conducted before; but this was the first of its at the national and resulted in the highest of ever recorded in a single.",was a and a of implemented by the right-wing that dominated the in from the 1950s to 1980s.,1
1150,"The mobile now provided on some, do not interfere with because they are wired to a special ``""that has been designed to safely receive and transmit in the.",Mobile can interfere with.,1
1151,", the and major in, said that and are interested in purchasing a significant in and including the in their .'s, , told and in a that and are receptive to the of including in their and``a significant""in the.",is one of the major of.,1
1152,"The of has announced the of a $3 million to to lead a researching advanced and computational to protect the . Under the, will also coordinate a of four university-based at the of, the of at and the of . call for a of $10.2 million in over three for and these to advance aimed at identifying common from numerous of.",will be awarded a $3 million.,0
1153,Clinical involve 240 in 10 with each questioned three.,Clinical involve an of 200 per.,1
1154,"The American ``""reported that at the (The) will recommend halting the on to this ,.",reported that at the said that is obligated to stop the on.,1
1155,"- () announced that it has become the first pharmaceutical to be accredited by the for the of () for ensuring the of human taking in early-stage clinical . The was awarded to's clinical () in, ,, and, where the conducts most of its I clinical . To earn the, participated in a rigorous , 15-month of the clinical at these.",is a pharmaceutical.,0
1156,'s () own will permanently replace the () that has been used on's.,'s will still be used.,1
1157,"One of two``released""early on , 19, of, north-west will appear before magistrates' charged with of forged, said.",will appear before magistrates'.,1
1158,"This was conducted on the sixth and seventh of, and included a of 861 with a of estimated at 4.","This was carried out on the 6th and 7th of, and included a of 861 with a of estimated at 4.",0
1159,", — A Venezuelan who says he is a of political by's requested political in on, one of his said ., a leading, has been charged with in but says his would not be fair . said there is``convincing""supporting his for and that's foreign should summon to explain his within a . Peruvian said earlier that entered as a on 4.",lost a presidential to in 2006.,1
1160,"Two other, and, have already pleaded guilty to aggravated and to obstruct and were sentenced to 21 and 18, respectively.",has been sentenced to 18.,1
1161,sabotaged along the linking to the northern at 1800 on 12.,were attacked by.,0
1162,"(), 12 89 () - is flowing in, where last, according to official, there were 4,600 of political, including (of's national), around 30 and many municipal and.",Around 30 were killed on 12 89.,1
1163,"In 1954, in a of to mark the 300th of with, gave to.",became of in 1954.,0
1164,", the leading is to greatly expand at a in, which has shaken up the by its of a radical, new.",The new thin-casting shook up the.,1
1165,The watchdog in on 19.,The holds a in.,0
1166,",, armoured, and a encircled the.",There was a.,1
1167,"The funeral headed to the of the in, where funeral held denouncing the as``of . ''","The funeral had been directed to the in, where denouncing as``of ,""were seen.",0
1168,"The on (), a global of the's, has released a urging and to provide with 'the about the and of on' . The is signed by 67 of the 92 of the, and that in some around the,``testable""about are being``concealed, denied or confused by not testable by"".",want to learn.,0
1169,"If you're feeling playful, visit our for a of, surf the or just sit back and with a good from our extensive . Alternatively, soothe away those tired, and with a Balinese.",Traditional Balinese is a where pushing.,1
1170,"The 42-year-old was outside a in central's, doing, , when a squirted with a disguised as a ,'s said.",was in when he was squirted with.,0
1171,The of started an independent of the shortly after the made that considered industrial a particular to US economic.,thinks that industrial is a to's being.,0
1172,"All genetically modified, including or maize produced from and, and, must be labelled.",selling genetically modified don't need.,1
1173,The rose 0.1 to 1573.65.,The rose.,0
1174,"The was made to pay' $27.5 billion, was originally sold for $9.4 billion to a little known which was later bought by the Russian state-owned.",belonged to the Russian.,0
1175,"died in such in, from a lethal related to the of a.",died of.,0
1176,"And although may not go down in as having the worst in (that may go to 2007's), her might have been worded a bit more eloquently . She answered:``I think it's great that are able to choose one or the other . We live in a that you can choose same-sex or opposite and, you know what, in my and my I think that I believe that a should be between a and a . No to out there but that's how I was raised and that's how I think it should be between a and a ."".",is.,1
1177,"to the who responded to my about leave ., the of leave offered to at international greatly from to.",leave in.,1
1178,"defended his to return up to 180,000 to the, within a and a, despite about the short of and heavily polluted.","As many as 180,000 could return within 10 to a that held 460,000 before struck.",1
1179,"The for a's at, on's in, has been rejected by the .``We knocked back a's on because of the ,""said divisional .``We already have a 24-hour's at, only one away, and there are already [anti-social at that . ''",accepted's.,1
1180,"Among the fascinating in the are where the of was signed, and one of's principal of, The, located in.",The of is located in.,1
1181,"has confirmed that there have been three small on at, and's, and another small on a . 26 on in . The has not found any injured, but one has reported themselves to a local . It is not yet known if this is connected with the.",there has been an in the.,0
1182,dived in.,The of the of the fell in.,1
1183,"The that our uses do not leave, do not have an unpleasant and are not toxic.",Our remove.,1
1184,"According to the The biggest for understanding Korean is that all have the same . For, the 'Speed' with.",The 'Speed' was directed by.,1
1185,"The said the of worldwide increased by 102 in 2006 to 793, a, largely due to bullish global . Their total net jumped 18 to $2.6 trillion.",The of.,0
1186,"The of, the Australian, and, of the privately-owned in the, are joining to build and operate a new in the.",'s and the's will build and operate one in the.,0
1187,"'s was a that eclipsed the previous by 21 3/4 . The still stands as an, and stood as a until leapt 29' 4 1/2""at the 1991 in.","2,45 is the in the high.",1
1188,"Speaking in the Russian of on, said the was``at the very least ill-considered and unprofessional because discussing such without the main is simply not serious"". Despite their bitter, Ukrainian and were both in for an international with the European, the and other key . The gets 80 of its from via a of more than 13,000km (8,060) of Ukrainian, some of which are 40 old.",is 40 old.,1
1189,",, a leading, spent a recent here waxing positive about how the's economic might prove the perfect for to sell more like and to . His improbable coincided with by a of descending on this, including, the, and the entire . All of them came to stress that this destitute stands at a between and``the ,""as put it.",The comes from.,1
1190,"The original of 1996, which was meant to harmonize the across the German-speaking, turned out to be a major if not outright.",A was approved in all German.,0
1191,A of's has been killed by Marxist who kidnapped him three ago.,'s has been kidnapped by Marxist.,1
1192,", the who claimed that a manipulating (possibly under the of Japanese) caused, has quit his at in.",has with the.,1
1193,"First becoming famous in her native in the 1990s, long-haired self-described ``""gained international for winning the 2004 with her``Wild ,""inspired by the musical of the of the Ukrainian Carpathian . In the five since, has decided to use her and public to represent a of worthy, including human, renewable, and even the basic of democratic, becoming a public of's and later serving in.",was born in.,0
1194,"was discovered and landed in 1902 by of the, for .'s.",. reached in 1902.,1
1195,"The, on, ordered the of 30 million of crude from the's to halt runaway triggered by.",European were considering releasing to help the after.,1
1196,Six prime is just one of the many stemming from these and subsequent.,is a prime.,0
1197,"Now it's at the--and with a, it's on to the at, and a there and will be back in for the and final.",The final was held in.,0
1198,"During the of 28 the 75 old's, called in . had previously been placed in with in 2006, but was rescued by in 2007 . A large followed in 2008, after 42 were closed . has worldwide in such as, and also makes under the for . At the of the 2008 there were 260 in the and 116 overseas, employing around 2000 . is reported to owe around million to and million to.",The has called in during.,1
1199,has initiated criminal in and the on the of their that and his stole confidential before defecting to in.,took from to.,1
1200,"Then the most important of the begins as go to the, their special of.",at the.,0
1201,"was born on 11 , 1869, in . After his, I, was assassinated in 1900, succeeded to the.",was king of from 1900 to 1946.,1
1202,"A slashed a to as he attempted to steal $6 off her - to buy . The 16-year-old, , now faces a first over the of 58-year-old from, . told he was approached by with a as he was burgling the . He took it from her and used it to attack her, before hitting her over the with a.",killed a to steal $6.,0
1203,"Local acting on of the European raided of and several this, a for the said . He did not specify which or which other were involved . However, a for, , said that's in and were among those searched . It emerged on 13th, that also took at's in, in to the anti-competitive . employs over 5,000 at its Irish.",engaged as.,0
1204,"had built the for his on 28th off, as he lives nearby.",lives near.,0
1205,Israeli predict the's coral could begin to collapse in as little as 30 from now . show the are becoming increasingly acidic as they soak up manmade of . The of say this will make it difficult for many coral to produce skeletal and other hard . The's on in the suggests a will be reached in between 30 and 70 . Then the of eating away at will outstrip the' to make the.,The of.,1
1206,"During, will gather at the for nightly prayer and evening.",The is a of for.,0
1207,", a.k.a the, said during a funeral for the,``They were all of killed during the . ''","The, said at the funeral,``They were all killed during the brutal . ''",0
1208,"It is outstripped only by, the, ,, and, and thus ranks 7th in the 25-member in of.",12 of the use the instead of their own national.,1
1209,"Two young have killed themselves after falling with suspected, following the latest in.",Many developed after the.,1
1210,"says, that he (a) and recently studied homeopathic of . A new - published of homeopathic to matched, randomly selected of medical - suggests that these apparent homeopathic are merely placebo.","What really irks and other of, however, is that homeopathic are not supposed to be used like medical.",1
1211,"The of the out that they merely record the of how the is used, rather than prescribe how it should be used . The, , has been in at least 20, they say . It was popularised in 1991 in's novel: for an Accelerated as one of the . Here it was described as``a, low-prestige, low-dignity, low, no-future in the . Frequently considered a satisfying by who have never held one . ''","A ``""is a low-paid.",0
1212,", 47, collapsed and died from a near the of after being caught up during the on his last . His , 26, said:``Through and pictures that I've been shown he got refused on a of that had set up . And the missing was what happened to him when he got into . I think what we've just seen has answered a of . ''",was hit by a.,1
1213,is delaying its by a because of logistical related to institutional registering to bid on the.,A for's would push the later into a that is traditionally light on.,1
1214,This of in western is the first confirmed on the since 1989.,A of was confirmed.,0
1215,"Four were released on and were ordered to return to a, when they may be charged with, a said.",All four have been released on and are due to return to a.,0
1216,"will take the of, changing it to the, when becomes.",will take the of.,0
1217,is one of the most remarkable in the entire of.,is a.,1
1218,The is over a glacial dating to about 750 million to 600 million ago.,A glacial occurred about 750 million to 600 million ago.,0
1219,", () - Australian, , has made an unannounced to, according to the of transitional.",is a political of.,0
1220,"In, diplomatic combined with military to create an to secure a rather than permit to undermine this fragile and.",The was formulated to end the in.,1
1221,last broke his own of the of climbing . .,is the first to have made the up the with no artificial.,1
1222,"supposedly had to classified that named as a as well, which adds more to the of the's of the of her . revealed's real, and that he was the registered of, ,, and . The that has no in, reports through a small funded by a larger conservative, operated under an assumed, and is directly linked with pornographic, have many questioning how exactly he received a in the first.",to.,0
1223,easily during the.,is easily flooded during the.,0
1224,"The revamped more than before, can give direct to factual, and features to help create detailed.",The can answer specific directly.,0
1225,"Eleven after 852, mostly, perished when the on a, an in the in brings back the and which have haunted since the.",100 or more lost their in a.,0
1226,"was also in to attend the & autumn/winter 09/10 and appear as one of the red-carpet at last's of, an celebrating 80 of in, supported by the of, , and the & . We meet in the swish . is self-assured and looking extremely grown-up in a tailored, brown and snakeskin . But the is nowhere in . Her is as dark as the wood-panelled of the . Why did she dye it?.",is the of.,0
1227,"British, who sang with her and sister as The, tied the with a in . According to the, which took in a 30-minute overlooking the, was attended by about 150 . The watched walk down the in a beside the at the ., who was born in and grown up in, found her, in.",is married to.,1
1228,"FROM two tiny high up and far back in's, with its neo-Georgian, straight-backed and, graceful, the of in looks down . The, on near on the, was built for a patrician white . But although it was completed in 1828, a after was legally abolished in, behind the and on either of the are two cramped, built so that black could worship there without being seen by white.",'s is in.,0
1229,"Another presidential, who we thought was the one involved, was, the standard of the who also has in the.",is a of the.,0
1230,The spoke at the military before he left for to attend the of president-elect.,is the of.,1
1231,"( )--The kicked off a major energy-saving, and hope one of the's most iconic can become an for worldwide . From the cloud-shrouded on the's 80th, former, and detailed $20 million in cutting-edge they hope will cut by 38 for the 1930's-era . They stressed the weren't green or of a . Instead, they say they're being done simply to save the's a of.",The of is.,0
1232,"The and Of and opened the's first major retrospective (19) with a attended by his ,.",Yoko is's.,0
1233,"assassinated as he sat in the presidential of's watching the light,``Our American . ''",was assassinated in the presidential of's.,0
1234,"has prominent sedative and anticholinergic/ sympatholytic (dry, , sinus, extreme) and causes massive . These side normally do not allow to give the in needed for full of, so it has to be combined with a more potent antipsychotic.",Levomepromazine causes.,1
1235,", 63, started his at 25 at the of . He worked at the Dutch of, and, at the in and at in . In 2004 he represented . in and prepared an in that trained and . A later was in of the . in and supervised the between the Indonesian and the.",in.,1
1236,"of the's 25 were voting in the biggest transnational ever held, and the first for the since the's into the former communist eastern on 1.",Nearly 350 million were eligible to vote since the took in 10 new on 1.,1
1237,"The of in the was first proved in 1974, but the and of the deterred from exploring the until the 1990s.",is explored in the.,0
1238,"'s promulgated new on 14, including the of an independent electoral to oversee the presidential, which is slated for 30.",in will take on 30.,0
1239,"\"" Our is in full ,""told her diary on , 13 , 1944,``thickly covered with and much more beautiful than last .""She would have been 79 this, turning 80 . Had she survived, would still be able to see the by which she measured the of during her two of from the, not just behind the in from which she and her were taken by the in 1944 but if the of the are realized at 10 around this, including.",died at the of 15.,1
1240,"On 8th, the released a which resolves this by explicitly disabling the of the: an external.",A is an external.,0
1241,Five other have been ordered to face courts-martial.,Five other have been refused to face courts-martial.,1
1242,"has been awarded an honorary for his``valuable to British"".",Italian is awarded an honorary.,1
1243,"The golden, found in an intact in 1977, is exquisite . It is now the in the archaeological in and the says that it came from the of, the's.",Alexander the's remains undiscovered.,1
1244,"According to, who is a of the current, , . and has ownership/employment with and, the septic was installed in the early 1990s.",is one of the of.,0
1245,'s directly to's.,is the of.,1
1246,"The chaotic unleashed in last, with the of, began on the 28th of in, when motorized paid murdered third public.",was killed in.,0
1247,"will return to his and then move on to in early to consult with, said.",is a.,1
1248,", 31, was found guilty of six of and.",A German was convicted of and of by lethal.,1
1249,"The was made to pay' $27.5 billion, was originally sold for $9.4 billion to a little known which was later bought by the Russian state-owned.",was sold to.,0
1250,"stated in an exclusive for ``""from that it would be disgraceful if puts a on's for in the and.",and are in over.,1
1251,Twenty-five of the dead were of the and the of the 67 were.,25 of the dead were.,1
1252,"Lao, , said has promised to announce its in.",Yong is a of.,0
1253,"searched rough off the for of a ferry that claimed at least 28, as blamed crew for the.",100 or more lost their in a.,1
1254,"said on, that there was an astounding from's--possibly the biggest in.",The biggest in was the of a from's.,1
1255,The set a this with 16.,The set a with 16.,0
1256,are all but unanimous in believing that must leave for the of the.,Cardinal from with to stay in.,1
1257,"Nine from have been executed for the of a Sudanese in 2006 . They were hanged in a in the, , in of the of the, . It was initially thought that had been killed by but a said an in his had angered . His decapitated was found on a a after he had been abducted from his in.",was Sudanese.,0
1258,"Elsewhere, took its first ever when won the's eight-hundred, while the's went to the Ethiopian.",The's ten thousand is from.,1
1259,"The are a major based in ,.","The is based in ,.",1
