,sentence1,sentence2,label
1684,in red and white kicking a.,A black stands in the holding a red.,0.0
1685,A and on a rocky.,and standing on next to,4.800000190734863
1686,splashing into the.,Four splashing in the,2.4000000953674316
1687,The smiling at the is buried in.,A in a with a on a.,1.0
1688,A with big is holding a small in it's.,A puppy with big chewing on a.,3.799999952316284
1689,The large brown is jumping through the tall.,The wearing a blue is running through a.,0.0
1690,Two fighting in the.,Two playing in the.,2.5999999046325684
1691,A brown is in the of a of chasing a dirty over.,There are two white and one chasing a.,2.799999952316284
1692,A is active in a grassy.,A of racing on a.,0.0
1693,Two are racing a in the.,The carrying a long in its.,0.0
1694,The is sitting at the of a rocky.,A sticks their out of a at the of a.,2.4000000953674316
1695,A standing on a is pulling another close by with a.,a in a black standing in of a and a,0.0
1696,a plays his white.,a playing a white and as well,3.200000047683716
1697,A is skijoring with a in the.,A brown is playing with a in the.,0.0
1698,Two shirtless young playing in the.,of play in the at the.,2.4000000953674316
1699,of a.,A of a flying.,3.5999999046325684
1700,in a black walking on the.,A watches a down the.,0.800000011920929
1701,A and a looking at the.,A and a.,2.3299999237060547
1702,a brown running through the,The large brown is running outside in the.,3.5999999046325684
1703,Three pulling a on a through the.,"The are pulling a on a of, through the.",5.0
1704,A in a red sitting in a is holding a.,A in a gray sitting in a of.,0.0
1705,"Three playing with hay, throwing some at.","Three young play in the, throwing some at the.",4.800000190734863
1706,A is standing on the next to the.,The are running in the with in the.,0.0
1707,A black wearing an is entangled with.,The black wearing a red off.,1.7999999523162842
1708,Two are playing around in the.,A posing for the in a red and white.,0.0
1709,A golden is running on the.,The large is running through the.,3.4000000953674316
1710,A runs through the.,a runs across the.,4.800000190734863
1711,a in red is walking along by a carrying a.,A is walking on with flowing around them.,3.4000000953674316
1712,rowing a.,a doing a on,0.0
1713,Three running on a.,Three round a at a.,4.800000190734863
1714,A black and brown through the near a.,An older stands outside a old boarded up.,0.800000011920929
1715,A is jumping into a after a.,A jumping into a swimming.,3.4000000953674316
1716,A running through a in the,A running through a of.,3.200000047683716
1717,The is playing along with the on the big.,Three holding with their to the.,0.4000000059604645
1718,Many run in a on a.,A puppy along a.,1.0
1719,A in swimming is standing against some.,A in a gray climbs a large.,1.0
1720,Two white walking in the.,A tan with a black in the.,2.0
1721,A wearing a in the with her and to her.,A wearing and leaps up in the with his and spread out to the.,2.4000000953674316
1722,A runs through the.,Two run through the.,2.799999952316284
1723,A running across the,A running through the.,2.799999952316284
1724,A is attempting to ride a small.,A and sitting back to back in the.,0.0
1725,The black and white is swimming in the.,A black and his on the.,0.6000000238418579
1726,standing on of jagged near the.,A is standing on of overlooking the.,4.599999904632568
1727,A in a black and blue is surfing.,A wearing a black and blue striped is surfing on a.,4.400000095367432
1728,The is leading a through an.,leading her small through an.,4.599999904632568
1729,Two on the.,A on the.,2.4000000953674316
1730,A young is standing on a tiled.,A young is practicing his in a.,1.0
1731,The is running with in his.,The is running with a yellow in his.,2.200000047683716
1732,Two running down a.,two running on the,4.800000190734863
1733,A black and white in the,A black and white running with in his.,2.0
1734,A has it's head inside a red and green.,A playfully investigates the of a.,3.799999952316284
1735,A yellow shirted wearing a golden.,"A in a yellow wears a, sun-shaped.",5.0
1736,A is scalling a with a.,A young is doing a ski with a purple.,0.4000000059604645
1737,A with his on his.,A little boy with his on of his,4.199999809265137
1738,A wearing a is canoeing in the blue.,A in an raising his to the in the.,1.7999999523162842
1739,An old in a black standing in a.,The is wearing a red and in a.,1.2000000476837158
1740,A climbing a cliff.,A climbs a.,4.800000190734863
1741,Two are in pajama and appear to be dancing.,Two with are eating a outside.,0.6000000238418579
1742,A white and brown playing with a black.,A white and brown is playing tug-o-war.,3.4000000953674316
1743,A plays.,A is playing.,3.0
1744,A wearing a red runs across the with a.,A is wearing in the.,0.0
1745,A black in the.,A in the.,0.0
1746,A smiling and a posing for.,A smiling holds a small wearing and red.,3.200000047683716
1747,A for a in the.,A is jumping in the.,3.200000047683716
1748,A and white with a is barking at a brown with a blue in the.,The with the red is bearing it's at the with the blue.,3.4000000953674316
1749,Two brown are biting each other.,Two brown biting each other on.,4.199999809265137
1750,A attempts a on the of a low.,A does skateboard on a.,4.0
1751,A young doing a back in the.,a young wearing purple running through,2.799999952316284
1752,A rides a snowboard down a beside a of.,A is grinding a down a concrete.,0.800000011920929
1753,A with two in socializing outside.,A young with a stands against the of a's.,1.399999976158142
1754,A small in a is sitting in a.,A in a sits in a.,4.199999809265137
1755,A black is running through the.,A black is running through the.,2.200000047683716
1756,a of are dancing on a wooden.,A of in dark colored are dancing on a wooden.,3.4000000953674316
1757,A young is riding a.,A young laying on a inflatable,0.4000000059604645
1758,A black running in the.,A black running on a.,1.7999999523162842
1759,Three in the by a.,Two drink in a.,1.0
1760,A runs along a with two black.,A little is petting a that is laying down.,0.20000000298023224
1761,"A teenage running on a, with an older walking behind her.",a young running along the at a,1.7999999523162842
1762,A and white is walking next to a on a.,A is laying on a of a in a green.,0.0
1763,riding a on a.,A in black on a riding a.,4.0
1764,The in the red is climbing the of a.,A is climbing the of a.,4.199999809265137
1765,A riding a while wearing a black.,A white is being ridden around a.,1.399999976158142
1766,a black swimming through a.,a black digging through the.,1.2000000476837158
1767,A and a are smiling.,A and a.,3.200000047683716
1768,A is standing on of a or watching the.,A standing in the watching a.,4.800000190734863
1769,Two little are playing on a.,Two little are playing on a.,1.399999976158142
1770,Two are jumping high in the.,Two nussle one another in the near a.,0.20000000298023224
1771,The holding a black is smoking a.,A with a black is smoking a,4.800000190734863
1772,A is running along the.,A brown is running in the.,4.199999809265137
1773,A with long is looking through a.,A stands against a near a.,1.0
1774,running on.,The is running on.,4.0
1775,Two wearing sit and look at the.,A wearing a blue makes a grouchy.,0.0
1776,Two playing with and behind them.,Two young wearing are playing in a.,3.200000047683716
1777,A in a is sprawling her out in.,A dressed in a is climbing up a large.,0.0
1778,A little in a red pulls a.,A in a red takes a on a.,1.399999976158142
1779,sliding in the.,sleeping on the.,0.0
1780,Three are playing in the.,Three swim in the.,4.199999809265137
1781,A white running on.,A white on the.,5.0
1782,A little with her in the is sitting on a's back while he is laying on a.,A runs in the opposite of who were playing a.,0.20000000298023224
1783,a red and white racing on a.,A is riding a in a on a.,1.399999976158142
1784,A black and white is running through a cow.,A large black and white in the,2.200000047683716
1785,A in a straw shades his while walk on a busy.,A lies on a with his under a parked that is jacked up.,0.6000000238418579
1786,A with a in of a gray.,in red standing in of.,0.800000011920929
1787,A in the.,Three swim in the.,3.200000047683716
1788,A little white curly haired runs across the with a in its.,A white curly haired runs with a in it's.,4.599999904632568
1789,"The is wearing a black, american, tartan.",A red-haired is wearing a black adorned with the American.,2.799999952316284
1790,A holding a net is standing in the.,A black and two black are sitting in a thatched.,0.6000000238418579
1791,A in an red squeezing in a.,A young in a takes a.,0.4000000059604645
1792,a walks two on down the,A walks two in the.,4.199999809265137
1793,A is running in the.,Two running in the,2.200000047683716
1794,A small in the.,The and white is playing in the.,1.600000023841858
1795,A in a blue and tan at a.,A smiling young in a and at table.,3.200000047683716
1796,a white running in the,The are running in the.,3.200000047683716
1797,The black is running through the.,A is driving his through the.,0.0
1798,A wearing a green and a walking on.,A small wearing a green and a walks through.,4.400000095367432
1799,A of sitting around a.,A of on a.,0.6000000238418579
1800,Three are running in a.,Two are running in a grassy,2.799999952316284
1801,A and with their on their are standing next to a.,The with a white and blue is standing in the of a.,0.4000000059604645
1802,The black and white has a in his.,A black and a white are standing on.,1.2000000476837158
1803,A white running through the,The black and white through the.,1.399999976158142
1804,A on on a snow-covered with in the,A enjoys a in the with and in the.,0.6000000238418579
1805,A on a to a.,A on a does a very high.,1.2000000476837158
1806,A going down the.,A brown is laying in the.,0.4000000059604645
1807,Two are running on the.,Two running in the,3.5999999046325684
1808,A is spraying a from a long at the.,A is sitting on his with one in the.,0.6000000238418579
1809,A in a red is touching the blue on another.,A fastens's in the.,2.200000047683716
1810,A bounces upside down on her on a.,A is bouncing on her on a.,4.800000190734863
1811,A standing in of and smiling.,A is walking by in of the.,2.0
1812,A doing a back into a swimming.,A red and blue jumping first into a swimming.,2.4000000953674316
1813,three little cover themselves with.,Three standing by a are covered in foam.,4.199999809265137
1814,The is looking up at the as another ignores them.,the is diving into the as the.,0.20000000298023224
1815,A black with a blue is running in the.,A black with a red in the.,3.200000047683716
1816,A sits in a.,A sits in a leafless.,3.799999952316284
1817,A brown on an.,A has an in its.,4.0
1818,A brown jumping into the to catch a.,three young jumping into the to catch a.,0.6000000238418579
1819,A is walking from one to another.,The hops from one to the other in the.,3.200000047683716
1820,A in the.,Two in.,3.0
1821,running along the.,A runs along a.,4.800000190734863
1822,A running through.,A runs in the.,5.0
1823,Four black run across the.,A runs across the grassy.,2.0
1824,A in red and black is hitting a with his.,A in a red striped heads a.,3.5999999046325684
1825,A brown is walking on the.,A chases another by a.,1.2000000476837158
1826,A placing a on a on the.,a holds a small on a at the,4.599999904632568
1827,A black is biting a light brown ear in a playful.,A black playfully bits another in a setting,4.0
1828,The is walking on the at the.,A along the.,4.400000095367432
1829,The black and white through the.,A black and white is running through.,5.0
1830,"Two run through the, one with a.","The is doing a, through the, on his.",0.0
1831,A black is walking on the with a in it's.,The black is running on the with a in it's.,3.200000047683716
1832,A walks toward a standing in a on a.,A policeman stands in a in a.,3.0
1833,A black and a white in the.,A black and a white in the together.,4.599999904632568
1834,A large black and white is swimming in the.,A black and white with a is in muddy.,3.5999999046325684
1835,A little with a on his.,A with a on his.,4.199999809265137
1836,Two sit on a taking a.,The is putting on his near an.,0.0
1837,A and a.,A and a.,1.2000000476837158
1838,"A black, brown and white running through a.",A white and brown runs in a.,2.8299999237060547
1839,are playing in a while two watch them.,in a while look on.,4.599999904632568
1840,Two splashing in the.,Two play together on the.,0.0
1841,The and white is walking in shallow.,A white and brown appears to be walking on the.,4.599999904632568
1842,A reads while on public.,A who has fallen asleep on public.,1.600000023841858
1843,A is running through a grassy while stand in the.,A is running in a large of causing it to splash.,1.7999999523162842
1844,A young riding a on a,A does on a on a surrounded by.,2.200000047683716
1845,The young is skateboarding at a.,a in a blue is airborne on a in a.,3.799999952316284
1846,A jumping on a near a.,A jumping on a with a to the.,4.400000095367432
1847,A is out in the at the while the sun.,A above their on the.,3.0
1848,A in to catch a.,The brown for a.,4.0
1849,The returns the to its.,Three in the together.,1.0
1850,Two jump off of.,Two jump out of.,4.599999904632568
1851,A with a young with bear in of a.,A in a stands in of a large.,0.6000000238418579
1852,A shirtless playing on a.,A shirtless catches a,4.400000095367432
1853,A wearing green in her.,A young wearing only green awkwardly with a.,0.800000011920929
1854,A in a red holds his for the.,A in a red is video taping a natural.,0.4000000059604645
1855,A jumps into a not-so-crowded public.,A jumps while on a.,0.800000011920929
1856,The are striking a for the.,A in is on a in the.,0.6000000238418579
1857,Four holding jump into a swimming.,Four playing in the.,0.0
1858,A pushes a with two.,A behind a with two in it.,2.799999952316284
1859,Two for the during an intense.,Two little and white are in the.,0.0
1860,The black is walking through the tall.,The black is running through the.,3.799999952316284
1861,Two black playing in the.,A black in the.,3.4000000953674316
1862,A over a.,A over a.,5.0
1863,A with a black sitting on a wooden.,A young with a black on a wooden.,4.599999904632568
1864,A black and a yellow,A black and a brown-and-white in a.,2.200000047683716
1865,Three in a.,Several playing in a.,3.4000000953674316
1866,A large white and grey runs through a yellow in an.,A white and black is running out of a yellow and orange.,3.5999999046325684
1867,A is doing the in the.,a doing the back in a,4.800000190734863
1868,A stands astride a on a rocky by a.,"A is wearing a white, purple and black.",0.0
1869,A brown is running through green.,A brown is running though a.,2.4000000953674316
1870,A small white and large on the.,A small is running past a large brown standing in the.,3.4000000953674316
1871,A holds a while another stands nearby in a.,A lady holding one while another is playing in the.,3.4000000953674316
1872,A black walking through.,Two black walking through the.,2.4000000953674316
1873,A black is running in.,A black is swimming with a in it's.,1.7999999523162842
1874,A dressed in green is playing with her tan.,A tan licks a while laying down.,1.600000023841858
1875,Two homeless stand outside with a.,Two homeless young holding a.,4.599999904632568
1876,A brown in the.,A in the murky.,3.5999999046325684
1877,One in an wearing a white is riding a.,The wearing a blue is riding a.,2.799999952316284
1878,A little is standing in of a wedding.,A standing on a in of a seated,1.7999999523162842
1879,A on a.,A on a in mid.,3.5999999046325684
1880,The is standing on the hitting a with a.,Two teenage are standing on beside the listening to.,0.800000011920929
1881,This over the top shows two taking a.,A with swim and taking a.,0.4000000059604645
1882,Two brown running together on,Two brown are running on the.,4.599999904632568
1883,A black is chasing after a red.,A black is running in the.,1.399999976158142
1884,Two with ride an.,A young is on a at an.,3.0
1885,A in the.,A brown in the.,4.199999809265137
1886,Two sit on the in of.,A in a walks a on the.,0.0
1887,A black and white spotted over a.,A black and white spotted is jumping over the small of.,4.599999904632568
1888,A on a.,A on a in,3.0
1889,Two running through tall.,Two are running through a grassy.,4.599999904632568
1890,Little white wearing a after a red.,A black and white a in the.,1.0
1891,A of standing outside of a.,A large of have formed a outside.,3.200000047683716
1892,A of four dancing in a.,A of do on colored.,1.600000023841858
1893,a of are jumping in the on the.,A of young jump up in the while on the.,4.800000190734863
1894,A waves around a.,A young is twisting a around in the.,4.400000095367432
1895,Several are sitting around a at.,A of are standing and sitting around on the at.,2.5999999046325684
1896,Two different of and white play on the.,Two playing in the at the.,4.0
1897,One and two dressed in,A and two dressed in.,3.4000000953674316
1898,"Two, one wearing a, in a.",in laughs while sitting near.,2.4000000953674316
1899,Two playing in.,Two play in the.,5.0
1900,A holds a while a looks at it as another holding a.,A stands with her out in a while another holds a.,0.4000000059604645
1901,A white is running in pure white.,"A, white running in the.",4.599999904632568
1902,A holding a.,A rollerblading on a.,0.0
1903,A of playing.,A of play outside.,3.4000000953674316
1904,Two on the in a.,"Two, one in red and one in white playing a.",0.0
1905,a into the.,A flies through the.,4.0
1906,A white with red is running in the.,a wet black with a red is in the,0.6000000238418579
1907,A little and a little hold on a shiny.,A little in a runs across a.,0.4000000059604645
1908,play on a.,Three playing in a,4.199999809265137
1909,A jumps off of one onto another.,A young jumps from one to another.,2.799999952316284
1910,"One pulls another, sitting in a red, along the.",A young pulls another wearing a silly in a.,3.4000000953674316
1911,An has its up and widespread during the.,The has its as it flies.,2.4000000953674316
1912,A in a blue is sitting on a under a.,A standing on a with a nearby.,0.0
1913,A sings into a by a playing a.,A sings into a with a in the.,4.400000095367432
1914,Three sheep on the grassy with a walking behind them.,a small of in the with a black and white in the.,2.799999952316284
1915,a is making his between two.,A jumps his in the between two.,4.400000095367432
1916,A young with a on with a yellow in the.,A young in a with in her.,1.7999999523162842
1917,A in a rides her along a white.,A in a red rides her in of a white.,4.0
1918,A brown stands behind some.,A dog while standing in the.,1.399999976158142
1919,A in a red is using a black to splash over a.,A in a is rowing across blue.,1.0
1920,The and white is running in the.,The and white run through the.,3.4000000953674316
1921,"Two teenage, one is smiling.",A little on a.,0.800000011920929
1922,Two interacting in the,Two play with each other.,0.20000000298023224
1923,Two stand at the of a.,Two stand on the of a looking around.,3.4000000953674316
1924,Two in a of red.,Two are playing in a of red.,4.800000190734863
1925,A young jumps off into a.,A young in red jumped off a large into the.,4.0
1926,A small black is in the.,A black is running in the.,3.5999999046325684
1927,A dressed in a is looking at the.,Two dressed in black are sitting in a making suggestive at the.,1.0
1928,A of are firing up a hot.,A large of riding brown and white.,0.0
1929,play with.,A and a.,0.0
1930,A is wind sailing in the.,A is running through the.,1.399999976158142
1931,Three racing on a,racing on a,1.399999976158142
1932,Two holding and walking in a.,Two walking past a of a.,1.2000000476837158
1933,A brown chases a,A brown squating on.,1.600000023841858
1934,in red standing on the.,A in red stands on.,5.0
1935,A is running through a backyard full of.,Three run through a.,2.799999952316284
1936,two playing around in the,Two play in the,5.0
1937,Two black and white are playing together outside.,Two and a black are playing out in the.,1.0
1938,Three running through.,A black running through.,1.0
1939,A sits alone against a,A is walking with a red.,1.2000000476837158
1940,A brown carrying a in its.,A swimming with a in its.,2.5999999046325684
1941,A young leans over her at a.,"A young, except for or.",0.800000011920929
1942,A climbs up a while their follows.,A climbs a while a black follows.,3.799999952316284
1943,A brown on the.,A running on the,2.0
1944,submerged in.,The is underwater.,5.0
1945,The is riding a down a.,A trick grinds down a.,1.7999999523162842
1946,A large gray is playing in the deep.,Four playing in the.,2.5999999046325684
1947,A riding his on the by the.,A walking his down the of the.,0.800000011920929
1948,A in in a.,A is biting a.,1.0
1949,A with floppy walking towards the in the.,A in of his own turning towards the and.,1.2000000476837158
1950,A brown is splashing everywhere by shaking the off of itself.,A white is standing by a shaking himself dry.,2.4000000953674316
1951,A black and white is running on the.,The black and brown is running through the.,1.7999999523162842
1952,Many middle eastern are sitting in the of a blue.,A of are riding in the of a.,3.4000000953674316
1953,with two ski skiing down a.,A skiing down a.,4.199999809265137
1954,A is eating fish at a.,A eating a large in a.,4.599999904632568
1955,A and two play in the.,A in red and blue looking down at the.,2.200000047683716
1956,A doing a on a.,A riding up to a.,2.200000047683716
1957,are standing on an moving up.,ride up an.,4.599999904632568
1958,A is running her through an.,runs her through with green,4.199999809265137
1959,The white and brown is shaking its.,The brown is running across the.,1.399999976158142
1960,Some are raising their and.,Three are playing in the.,0.20000000298023224
1961,A blowing a large.,A walking a large black.,0.0
1962,Two sit on a near the.,Two sit on the of a in the of still.,3.799999952316284
1963,goal-keeper on the in of.,A is laying on the in of the.,4.599999904632568
1964,A wearing blue snow is flying through the near a.,A stands on his in the in of a.,1.399999976158142
1965,The brown is running along a grassy.,A brown is running along a grassy divided by.,3.4000000953674316
1966,The is wearing a striped and.,a wearing a black and white on a back,0.0
1967,A tattooed in black playing a white and.,A in a black and white and.,0.0
1968,A running along the.,and girl along the.,1.399999976158142
1969,A young and sitting on a outside are kissing.,The and sitting on a are kissing.,4.599999904632568
1970,A brown is jumping up to catch a green in it's.,A to bite a green.,3.200000047683716
1971,A black is running in the.,A black and a brown running in the.,3.200000047683716
1972,A is sitting on a with a at her.,A is riding her.,0.5
1973,Three play in a grassy.,Some play in a.,1.2000000476837158
1974,A young in a red.,A laughing lies on a of blue.,3.0
1975,A on a.,A is riding a.,4.400000095367432
1976,The gets to the of the.,The rides the at a.,2.4000000953674316
1977,Two in a.,in a.,1.0
1978,Two are walking on a in the.,Two walking down a in the.,5.0
1979,a and white is running on the.,The and black is running across the.,3.4000000953674316
1980,Two run side-by-side on the.,Two running on.,4.400000095367432
1981,Two are peeing at a red.,Two are urinating on the red.,5.0
1982,A in dark is carrying a light colored with outstretched.,A brown in the while carrying a in it's.,0.4000000059604645
1983,Two are walking through some.,Two are walking by a in of a.,1.2000000476837158
1984,A in the.,A in the murky.,4.0
1985,A of are walking down the of a big.,A of are riding in the of a.,1.0
1986,The is in the above the.,The is laying on a with a blue.,1.0
1987,A black is running through some.,A in a is running with a during a.,0.0
1988,stands in waiting on.,A stands in a dimly lit.,2.0
1989,The is sitting with a little in the.,The is playing with the shaggy little.,0.6000000238418579
1990,A large is running with a green in its,The is carrying a green in its.,4.400000095367432
1991,A of in racing towards the.,A of watching a.,0.0
1992,A is riding a in the above a.,A is riding along a located with a wooded.,0.6000000238418579
1993,A down the at.,"A brown on the, holding a.",0.0
1994,A is squeezing through an in the.,A sized brown is running through an open white wooded.,0.0
1995,running with a in its.,The black and white with a brown in its.,2.0
1996,A young running on the.,A little running at on the of a.,4.199999809265137
1997,A throws the.,The holds the.,1.600000023841858
1998,A is swinging on a over.,A in a bathing on a on a.,3.0
1999,A young dressed in a and an older walking down the.,a wearing a white holding a walking through the.,1.0
2000,How about some from real?,"Also, who's to say there aren't from``real""on there?",3.0
2001,"\"" Then the was gone.",Then the came back.,0.800000011920929
2002,The is simpler than that.,The is simple.,3.799999952316284
2003,.,.,1.0
2004,"So, I am dropping, for now, asking you the:``Where' s the ``?",I am moving on to ask you the:``Where' s the ``?,0.4000000059604645
2005,go You're asking me to prove a negative?,You're asking me to prove a negative?,4.599999904632568
2006,I am OK with!,I AM OK!!,5.0
2007,The for you need have gone up due to.,The of you own have gone down.,2.0
2008,in the middle.,A in the middle.,5.0
2009,Originally Posted by was it authoritarian?,Originally Posted by I give up.,0.6000000238418579
2010,Imagine a that's white and black.,Imagine a with and.,1.0
2011,There's no of a fair.,there is no at a fair.,5.0
2012,is very different than.,is.,3.5999999046325684
2013,We in think differently to.,Originally Posted by We in think differently to.,4.0
2014,If you answer yes to and no to you are probably straight.,If you answer no to but yes to then you are probably straight.,3.0999999046325684
