,sentence1,sentence2,label
1826,"A former federal arrested in the has been fined $107,000 for . , 57, was also sentenced to 18 and ordered to complete 150 of . The fine represents 50 of the federal did not pay on nearly $700,000 in he received in for approving excessive to the in 1999 and 2000 . In 2005, pleaded guilty to and and received a conditional of two less a .``was not only involved in fraudulent, he compounded that by not reporting that ,""said at a sentencing earlier this .``He effectively committed two of extraordinarily serious .""'s is the allowed by . said there is little will ever pay off the.",is involved in the.,0
1827,The has been made aware that located at is under by the of for the illegal of hazardous chemical.,Hazardous have been discovered at.,0
1828,"Any over will no longer enjoy higher-rate, which is considered a substantial to save for wealthy . From 2011, who earns £200,000 a, for, and pays the typical of 6 per of their into their will lose out on a or £2,400 a ., when he announced the in the, insisted that just 1.5 per of - the of about 450,000 - would be hit, but argued that it would significantly damage the already beleaguered, and cause many to think twice about investing in a.",is of.,1
1829,"Radical, , and nine other foreign said to pose a to the's, have been detained, pending.",10 foreign were a to's national.,0
1830,"Despite the in, there is little that will pull the nearly 9,000 Israeli out of, now a closed military.","9,000 are employed by.",1
1831,"was followed by, and after acute, followed by a long of apathy, from which relieved in 1745.",died in 1745.,0
1832,"An's travelled 2,000 to commit with the of a who built a that gave her a lethal of.",The in the injected lethal into her.,1
1833,"again became the of national political in the late, when led the in eastern that broke the on political and ushered in the of.",In the late 1980s became the of the.,0
1834,nearly doubled to nearly $1.8 billion.,nearly doubled from nearly $1.8 billion.,1
1835,and treat two to three injured.,assists surfing.,0
1836,is used in manufacturing such as and other.,is used in the of.,1
1837,"on is not consistent with the to put an and actively repress the of . The is not based on the of a native, , in the, but on an active against the Colombian, which has created a great and in with powerful outside its.",A native is destroyed by the Colombian.,1
1838,The marks the second into by which in beat British American to acquire the for 40m - the biggest western in the so far.,The of the is the biggest in the.,1
1839,"At (1970) is The's first live, and indeed is their only live that was released while the was still recording and performing regularly.",At was recorded by The.,0
1840,"who was kidnapped from the elite of 14, , has returned . He was kidnapped on 13 , 2006 and released by his . The have made an in the of . The other two accused are absconding . The claimed that he was kept in a and was treated nicely by the three.",was kidnapped in.,0
1841,"tacitly blamed's for the which prevails in the as a of the's () offensive . Meanwhile, blamed the extreme-, of for the of six at the.",is suspected of the of six.,1
1842,"The human may be more than 100,000 old but the of its numerical has come in just the last few : 2.6 billion of's 5.6 billion have been born since 1960.",The is 5.6 billion.,0
1843,19 said a for the independent who attempted to determine how many involved in in the contaminated around the nuclear after the 1986 were still alive was told by the of that non-state could be refused to any.,The at happened in 1986.,0
1844,"The new went an extra, suggesting that the that the to help bridge the damaged, are key to.","The, reported, isn't the first to show that offer tantalizing for spinal.",1
1845,"After the were identified, public in the and began giving the to large of . now say the is under and is not a public.",is under in the.,1
1846,"A powerful, hidden in a, exploded outside the of's secret, , causing severe, said.",An on's was carried out using a powerful.,1
1847,"There can be no that the already is weary of, a populist priest who in , 1990, won an overwhelming in's only democratic presidential",became of in 1990.,0
1848,"Named the in of its, the opened in 1959, drawing huge and stirring considerable.",The was opened in 1959.,0
1849,"The, designated to shed on and human during the apartheid, accuses the of carrying out and without in, and also of playing an active in the political that took between 1990 and 1994.","The accused the of, and human.",0
1850,"In 1867, obtained a on a special of, which he called ``"". The quickly proved its in and in many.",is the of.,0
1851,was anti-communist as well as nationalistic.,was nationalistic.,0
1852,"In 1975, a 19 old was handed the of, despite the of and more experienced in the.",became the of in 1975.,0
1853,It is estimated that the resulting from the of a on a nuclear would be a of the in the worst by a of 60.,The had outside the.,1
1854,"On 6 , 1945 the atomic was dropped on the Japanese of . The, piloted by, was chosen to make the . The was recorded as successful by . at 9:20.","In 1945, an atomic was dropped on.",0
1855,"Even realises the of's tautly-directed ., , with, ,.",The 'Speed' was directed by.,0
1856,", the highest in the, rises to a of 7,965 (2,428) and is less than 25 (40) from the of de.",is near the of de.,0
1857,"The includes, who won the 1984 for his to apartheid in, and, who won the 2004 for her on the and . in the's' are, who won the 1997 for her on banning; and, who received the 1976 for their to end in, and, who is the of.",is the of.,0
1858,"called on established to form with new and to transfer to new, to ensure productive of transferred . One of the is that some of the transferred have fallen in due to the and of among the new . The has rejected of the with that initiated in under.",was born in.,1
1859,"'s outside the in the in the of, left a huge in the.",is an of the.,1
1860,"THE of and were set to begin two of in, amid continuing in.",and entered a over their.,0
1861,was jailed for following the of in 1995 . He had run up of 850m on the.,was arrested for of.,0
1862,The dual has been a major for the and many of his have been secretly advocating against his in the.,does with his.,1
1863,"His (or her) is always to form a based on a in the and a general on ('). During a barter, letting of some to achieve.",Three form a Dutch.,1
1864,"The ferry fleet about 70,000 a between and, a 5.2-mile across that takes about 25.",The taking from to crashed into a.,1
1865,"The eighth are set to take in, . For only the second the are being held outside, following the 1998 in, . And for the first ever, there is just one combined organising for both the and . Just 10 after the, the will begin in the same.",The 2002 took in.,1
1866,", fired as's chief executive before the was bought by, was in last.",works for.,1
1867,"Often criticized and blamed for politically unpopular, and confronted with numerous, the is experiencing a difficult with to which to adopt, in particular in.",The is criticized for its.,0
1868,"will stop selling its own of 500-milligram acetaminophen and pull from wide, said.",will not sell its own of 500-milligram acetaminophen any longer.,0
1869,", whose served in the in, said he has always had a great for the military and wanted to do his to help.",'s belonged to the.,0
1870,"Within of a second after the, they have reasoned, the primordial - many of hot - must have created a that contained equal of and.",The is the primordial from which the was created.,0
1871,"Over 100 died in a massive at the, in the western of, . 168 were killed, with just as many injured . A collapsed, causing among of of gathered who then began to run for, causing the . Several are still believed to be trapped under the.",100 died at.,1
1872,"Last's of Italian, with``14.3 billion that must still be accounted for"", is given as for``a of effective and regarding financial"".",Parmalat 14.3 billion.,1
1873,was boosting its.,was boosting its own.,0
1874,"The (1923) is a of a small-town, (played by) who comes to to be in the . This, produced by, followed earlier about the and also paved the for later about, such as King (1928).",starred in The.,0
1875,", the pro-Aristide of, said he had been told that the will go to, and to against the of ,'s first democratically elected",is the of,1
1876,The's on the proposed shall describe the's on the for the.,A hydroelectric is proposed or is under.,0
1877,has beaten and to the 2003 of the.,selects of the 1994.,1
1878,"Thirty ago [1969, took's first small on the, declaring it``one for""only to have the to tinkering in low.",The was first touched by in 1969.,0
1879,"through en to ., the German, direct daily from to, and the with, an Austrian, on, and to fly directly to . Another German, , also flies direct from to and on and . is the for to most of the's smaller.",is the German.,0
1880,"The, endorsed by's top, captured more than of the 3.3 million counted so far, the said.","The won more than of the 3.3 million counted so far, the said.",0
1881,Voting for a new European was clouded by over.,Voting for a new European has been clouded by.,0
1882,The first was founded at near the of in 1909 and there are now some 300 in.,The first was founded at.,0
1883,"for the three ended 30 , 2005 were $42.78, an of 38.5 over the same in 2004.",have risen by 38.5.,0
1884,"The's confirmed that, who celebrated his 54th on, married 30-year-old in a private in his in the of and . was born in, but was raised in . She has been a lingerie for's and . The met through mutual around a ago . The is's first and' second . The's first, actress, was among the at the . (0).",' second is from.,0
1885,"\"" This is a major on our to, and I want to thank the of who came together in common to make it happen ,""said in his weekly .``I will sign this into shortly, and we'll begin making the immediate necessary to put back to work doing the needs done . This historic won't be the of what we do to turn our around, but the . ''",The wants to boost the.,0
1886,A must have confirmed by a.,A of was confirmed.,1
1887,"( born 12 , 1924) is the former 41st of the of . immediately upon his from the in 1944, married.",The of .'s is.,0
1888,"Two of's biggest financial on announced to merge and create the's largest, underscoring growing that the's long troubled has significantly improved.",The of Japanese creates the's biggest.,1
1889,"Although was selling its at lower in the, the increased helped lift operating in the domestic by 25.1 per to 858m.",cut to restore's.,1
1890,"It was difficult to assess the behind increased in, but its seemed to be to continue a of against and the in () in to undermine the, , for Peacekeeping, told the this.",in.,0
1891,"were scouring for a German who abandoned three small in a in the north-west Italian of on and have not been seen since . The, , 26, the of the, and her, , 24, brought the, aged six, four and eight, into the . They took a together and placed their like any other of, according to the's, . But about 45 later, while the were still eating, the stood up and told that they were going outside for a . When they failed to return the restaurant became worried and called the.",had a of.,1
1892,"this rose sharply in and reaching a 42,33 per , 2.45 US more than last.","this surged to an all-time in, at 42 a , 1.92 a more than last.",1
1893,"While ran for or fled to the, Russian were seen edging their guns closer to, and were offering little.",is the of.,1
1894,The has developed into a natural for with the of as the second national and primary of.,is the primary of the.,1
1895,"The American``.""quoted undisclosed at the, , saying that the intense on may cease by the of this.","The ``"", quoting in the American of, revealed that the of might end this.",1
1896,"Solar, ,, have announced an with for of solar . The will result in the of 500,000, capable of generating 11MW of . Spectrolab produces solar, originally designed for powering . The solar are three more efficient than the used in typical domestic, and are capable of converting light to electrical with up to 34 according to's for . Solar utilise's solar to increase the of their dish.",collaborates with Solar.,0
1897,"Well, the is on us, the are winning, and at a.",is winning the against.,1
1898,"The two, and, were honored with a 21-gun.","The two, and, were honoured with a 21-gun.",0
1899,"of the said that the of the are``a small, fascist underbelly, hell-bent on causing and destroying's egalitarian . ''",is the of the.,0
1900,"Medium-size black actually do exist, according to the latest from's Hubble, but had to look in some unexpected to find them . The previously undiscovered black provide an important that sheds on the in which black grow.",Hubble black.,0
1901,"The, it was clear, had blasted a in the holding back's of . While the seemed to be reacting to a that had left at least 164 dead and 308 injured, they were really venting the of having to cope with in a with an so stretched that simply getting to work and back is an . At peak, the - which carry six million each - are packed with up to 5,000, even though they're built for 1,800.",The claimed at least 164.,0
1902,"Last, recalled all of its 60 million of dry and wet and after began to fall and in some died of .``Natural, ,, is issuing a voluntary nationwide for all of its and the dry only, regardless of . The recalled include and canned and bagged, and, and and dry . Recent show that the contain melamine . We believe the of the is a . Natural has confirmed this that some of these may contain ,""said a released issued by.",Natural produces pet.,0
1903,"was offered and accepted the of and to the of, one of the, but when he reached he found that the had been given to another.",worked for the of.,1
1904,A of marine are harvested commercially in.,is harvested.,0
1905,"The nine, aged between 19 and 32, are being held at high in central.",between 19 and 32 are being held at high in central.,1
1906,The is suspected of being behind several deadly and of in.,The may have caused suicide and.,0
1907,"That, a first proposed by and often reiterated by British, seeks to find a single of that can explain all the fundamental in the: ,, and the strong and weak interactive among subnuclear.",is a.,0
1908,Wal-Mart faces huge,Wal-Mart faces a,0
1909,"in have been combing the grisly of a Colombian which crashed on, killing all 160 on.","A chartered, filled with returning to the French of, crashed in, killing all 160 on.",1
1910,"Even more than other economic ,'s financial are concentrated in the.",", retail, , and are all centered in the.",0
1911,"- (commonly used in), is the basic of issued by the's of.",is the used in.,0
1912,"Other were not surprised at his .``I wasn't surprised ,""said, a former of the, a favourite of .``I never expected to die in a with coming out of him .""have said how his broken had prevented him from leaving his as often as he had liked to . One and long-standing, , said was clearly hobbled by the broken .``Medically speaking, he's had a rotten . ''",The is owned by.,1
1913,"to a global on the that was passed in 1989 by the on in of and (), the elephant may be reversing its spiral toward",The on has been effective in protecting the from.,0
1914,"'s and have agreed to settle a multi-million out of, for both say . has been accused of killing 11 and injuring 181 when an was tested on them during a in 1996 . The denies the, saying they were of the . The told the would be paid to, but could not yet be disclosed . said would also be given to a local.",is accused of murdering 11.,0
1915,", which claims to have produced 13 cloned worldwide, told the daily two had signed agreeing to pay $200,000 to conceive through.",has cloned 13.,0
1916,The recognizes the following for their generous in helping to protect the and of.,The would like to acknowledge and thank the following for their generous.,0
1917,said that they have recovered stolen by the late worth more than $1 million.,recovered 81.,1
1918,A senior al-Qaeda who was said to be planning an on has been arrested.,"Despite, the British denied any specific had been made to target.",1
1919,"If any legal is due to enforcement, ,, or, the successful shall be entitled to reasonable and other incurred in the, in to any to which they may be entitled.",The prevailing shall recover.,0
1920,"The 26-member said, , that would release to help relieve the caused by.",The international agreed to release from to help avert a threatening the.,0
1921,"Meanwhile, the spearheaded by di and began to focus on's private and public.",di is a.,0
1922,"Meanwhile, in an exclusive with a, the first one-on-one given to a Western since his as of earlier this, attacked the ``""to bring the of's nuclear to the by the, , and.",is a.,1
1923,"The of which led to the of ,'s oldest, is a of how not to manage a.",was's oldest.,0
1924,"This describes American, the, , and the on and explains how legalizing would reduce and public.",has.,0
1925,"is the of the - . was founded in 1983 and became the armed of the to carry out terrorist against the militarist of the . Its is a for, considered a Chilean in the of the of against.","\""""is the of.",1
1926,the Swedish who chairs the said that while had been cooperative in helping his establish for and verifying the it is unclear how the will react once the is in.,is a Swedish.,0
1927,"say last's massive was marred by and and that the must beware of allowing his, sponsored by the, to be seen as legitimizing an authoritarian . The in twice have denounced the for leaving its mired in while enrich themselves off and . Since he arrived on from, the has met with dos and spoken out against in, the with the fastest-growing in the.",The talked about in during his in.,0
1928,"told me he had discussed the voiced by with the's longtime, , of the.",is the's official.,0
1929,"If this you, you might enjoy reading``Punished by""by.","I read``Punished by""by.",1
1930,", stormed a in on, killing 13, including two provincial, and wounding 14 . One detonated a at the of the provincial, as the stormed the with and . and six were killed in the 20-minute, which ended when two of the blew themselves up in the main, said the provincial ,.",Five were killed in the suicide in.,1
1931,"accepted an 11th-hour to flee into exile ahead of the U.S.-led 2003, but scuttled the, in this claimed.",flees to the.,1
1932,", the biggest in the, was once a of and his who led against the.",is a key.,1
1933,"In early, and, respectively the of the two of, startled by announcing that they would meet for the first in four.",was divided into two in.,1
1934,was found guilty 26 of 161 of first-degree for 160 and an unborn in a.,The against are for 160 and one's.,0
1935,"Twenty ago, on 6 , 1968, died at in , 25 after he was shot at the by.",killed,0
1936,British crashed into a in to free the two who were arrested by and.,stormed a in.,1
1937,"Rose made his first since joining the 10 ago, replacing, who has an infected.",Rose joined the 10 ago.,0
1938,"( born 29 , 1904 ,; died 20 , 1970 ,) was one of's most prominent in the second of the 20th.","died on 29 , 1904.",1
1939,", a Chinese that makes's, has stopped selling its popular, which is sold nationally in, after confirmed the of . owns the . Earlier their powdered was found to contain which sickened over 53,000 and was responsible for the of at least four infant . has stopped exporting their to the nearly 50 overseas that buy them . has also been found in in and vegetable made by . It has also been found in which are manufactured by the Chinese, . Another Chinese called has also halted the of several such as, and made with over that melamine laced powered has contaminated their . So far there have been no of any associated with.",4 died in because of contained in.,1
1940,"will hold the first presidential in its, between and's hard-line, said.",'s hard-line will face in a.,0
1941,"were still expected to unseal an 11-count against the's, . He violated by his from the during, when lost of the.","entered his guilty to 11 of and also to lying to about his medical, under an reached with.",1
1942,are working to reduce the between and.,are working to shorten the new to an of eight to nine in the.,1
1943,", 10, '90 - The national reported that over 15,000 have been arrested in in a aimed at uncovering the of former, who was murdered in a terrorist ,.",was killed on 9 '90.,0
1944,"\"" When we apply this to young, it allows us to predict what might be their future - the of that they'll get by, say, their late 20s or early 30s ,""says . Called the and (), the measures the relative in of different of called . The same are present on tooth.",A can predict.,0
1945,A Cuban who is accused of.,accused of,0
1946,Voting for a new European has been clouded by.,clouds.,0
1947,", a close and longtime, said she and a of, and spent 18 making's again.",is due to live at again.,1
1948,"The disputed lie close to the and, which Indonesia lost to in a legal in the of in 2002.",There is a territorial dispute.,0
1949,", who had to borrow to buy to make, received 25 a from . After giving them to pay off her, she was left with 2 a, barely enough to feed herself.",was not able to feed herself.,1
1950,"With hinting it might soften its tough to break the, top, , said the two needed to review the.",is a of a top.,1
1951,"According to, the newfangled will be able to peer so far back in and, thus, that they``will see the first assembling a few hundred million after the . ''",The is the primordial from which the was created.,1
1952,and bee can be threatening if you are allergic to the.,bee can be fatal,0
1953,"killed the of the, or, which has claimed for killing 61 in the last.",The stands for.,0
1954,", the of, and, reported net of $374m in the third, or $1.84 per.",loses $374m.,1
1955,that is the of so it's better to learn it to understand clearly all the in.,is the of the.,0
1956,", an official of the Russian, has announced that, in with the recent terrorist, about 100 Russian will be evacuated from near future.",evacuated.,1
1957,"Among the 21 left over after the previous ended on 1 , 2006, the and the archeological of were doing well in earlier . A for the said earlier this that the is wide open . The will be held in, . actress, and have been announced as, astronaut will be present, and will include and.",will not perform in.,1
1958,"then fought on the of the in the 1921-22, with those who favored of the which brought between and, but at the of a divided.",has been divided since 1921.,1
1959,"Two prominent have made guest on the, and, the theoretical whose has been compared with's.",is a.,0
1960,The said may bar the of life-sustaining from comatose who have not made or cannot make their known.,"In most, the is comatose or mentally unable to communicate his/her.",1
1961,"From to to, the joining on the rock-charged one clear common: is one of their most respected and beloved.",is in with.,1
1962,"The of, the ultimate of Italian, has been engulfed by since revealed and his advised a local in a for against.",for.,0
1963,"They, too, have not produced a practical, commercially acceptable.",is commercially used.,1
1964,"The of and said that the was inspected in, and cited for 15, seven of which were considered serious.",The was inspected in and cited for numerous.,0
1965,"of has expressed her after a with al-Bashir, during which her and were mistreated by Sudanese.",is the of.,0
1966,"If you suffer from certain genetic, or carry a for that, can take one or two to check for those and transfer only healthy.",can determine whether an has genetic or is a of them.,0
1967,was found innocent in of the for a third 7.,lives in.,1
1968,", whose pioneering revolutionised police, told the were being``branded as""because the retained of arrested, regardless of whether they were later convicted . The now holds more than five million, up 1.4 million in two . also called for improved genetic, warning that the current could result in a of, in an with the Guardian.",is the of genetic.,1
1969,"found a new to answer to the that have to ask him . So he held a``virtual""in which could write in and he would answer them online . He was asked many, and one of the most important was about the of . was very discreet about it . We will give you the full:``With over 1 out of 30 controlled by the penal, why not legalize, , and to change the failed on into a, saving to the? Do we really need that many?""The's was a strategical . He started by quoting the he was asked which was whether legalizing would improve the and . And he answered:``The is no, I don't think that's a good to grow our . All . ``.",is in of the of.,1
1970,specializing in defused the . Some 100 were working inside the.,100 were injured,1
1971,"There have been that the of the, , was wounded in . on and asked to pray for and said that an interim named had been appointed . The of these is currently unverified .'s did allege that the were correct, however . During a, he reported,``We are not sure whether he is dead or not, but we are sure that he is injured . ''",is affiliated with.,0
1972,A leading human on identified and as the likely in eastern of secret where al-Qaeda are interrogated by the.,secret were located in.,0
1973,"immediately expressed over his and suggested that``ulterior""may be at .``It is understandable if some do not understand the Chinese on, but I am afraid that some may have ulterior, and this we cannot accept...is also concerned about the humanitarian in . But empty will not help . We hope that relevant will be more pragmatic ,""said, the of the in's foreign.",is an of's foreign.,0
1974,"is quite simply one of the greatest in the of, capable of leaving an entire for dead with his and dribbling, voted of the on three and already a double.",selects of the 1994.,1
