,sentence1,sentence2,label
2745,had been living in a protective since being transferred to the on 3.,"He had been in protective since being transferred to in, said.",2.799999952316284
2746,The 2000 Democratic supported``the full of and lesbian in the of the . '',The's 2000 didn't explicitly support but backed``the full of and lesbian into the of the . '',3.200000047683716
2747,"Its fell 71, or 3.5, in after-hours to $19.55.","The had risen 63, or 3, to close at $20.26 in.",1.25
2748,"of and swamped the grounds before the, which was carried live on national.",of and swamped the and the short involving the five-time was carried live on national.,3.0
2749,'s jumped 7 year-on-year to $402 million.,"Second-quarter grew 7, to $645 million from $600 million in 2002.",2.200000047683716
2750,"seemed agitated when she came to help prepare for's upcoming 104th anniversary, said.","of said , 43, was agitated when she came to the, in the on the's east.",3.5999999046325684
2751,He was the of in a of depicting that has been issued to.,He was the of in a of showing of most-wanted.,4.0
2752,", of the Liberal of, won 31 of the, while the independent got 4.","A pro-independence, , of the, came in second with 31 of the.",3.0
2753,"So far, has been returned all but $70,000 of the it wired.","has received all but $70,000 of its back with the of the.",3.75
2754,"The reported 65 new on 22, a one, and 55 new on 23, making's epidemic the in the.","reported 65 new on 22, a one-day, and 55 new on 23, making its epidemic the's.",5.0
2755,outfielder was suspended for eight by major for using a corked.,"was suspended for eight by major for using a corked, and he immediately appealed the.",3.200000047683716
2756,of the were given a daily of the and took a.,Half the received a daily of the plus while the were given a.,3.200000047683716
2757,"When removed the four from the, they weighed 136 combined.",Each weighed less than 50 when they were removed from the 10.,3.0
2758,"While the had one, and about three for the, with several between each.","Instead of one long to separate the, and about three, with several between each.",3.5999999046325684
2759,"The has expanded into providing other for, including.","The has expanded those basic, offering and even.",4.199999809265137
2760,The killed two and injured more than 150.,The killed one and injured more than 100 other.,1.7999999523162842
2761,"In 2001, named to the of.","In 2001, named her to the, the largest for.",3.2309999465942383
2762,The has faced of that have not only angered' but and some.,"The of angered not only' but and some, to the that could no longer run the.",3.0
2763,A federal in ordered him held without.,"was ordered held without by a federal in ,.",3.0
2764,"The's threatens to alienate social, who have provided strong political for and.","The's disappointed some, and it threatens to alienate social who have provided strong political for and.",3.75
2765,has the's highest with 4.7 million infected with or.,"With 4.7 million infected with or, has the's highest.",5.0
2766,"In that, will report to, and of.","As executive of new, will report to ,'s and chief.",3.4000000953674316
2767,"The new is the commanding, who is now promoted to major general.",has promoted to and named him.,3.200000047683716
2768,was founded five after was acquired by for $425 million.,was sold to in 1997 for $425 million and is called.,2.799999952316284
2769,"The was given two to restore the $1.50 and the old, declared.","The, which plans to appeal, was given until 28 to restore the old and and the old.",2.799999952316284
2770,"\"", we are trying to convey this to and . ''","\"", we are trying to convey this to (-) and (-). ''",4.599999904632568
2771,"The wants to kill the in approximately a 1,700-square-mile near the of.","The wants to kill the in approximately a 1,700-square-mile near to establish a moose of.",3.200000047683716
2772,"told he fished alone in on, returning to an empty.",told he left his at about 9:30 on 24 to fish alone in.,3.0
2773,"The's far exceeded by jumping to 26.8 in, a, from 10.6 in.","had pulled back from when the far exceeded by jumping to 26.8 in, a, from 10.6 in.",3.799999952316284
2774,"said there was``a or have been in this"".","Detective, leading the, said:``There is a or have been in this.",4.5
2775,"declined to comment on, as did.","declined to comment, saying that he never discussed.",3.0
2776,said he would donate his military to for the he was in at.,Maj-Gen said he would give his military to while he served at.,4.7270002365112305
2777,", bench and right were ejected for arguing after was called out on to end the ninth.",", bench and all were ejected in the of the ninth.",3.799999952316284
2778,"The owns five and more than 2,100 filling in and.","has six producing, five and 2,100.",3.0
2779,"Other in the refine his original, said.","Many of the are to the original, said.",4.599999904632568
2780,",, criticized the's in.",",, said he wanted to congratulate the.",2.0
2781,"There are now 37 active probable in the, compared with 70 on 6.","And, globally, the of active probable has declined to 573.",1.5
2782,"has killed 296 on's and infected more than 5,200.","Throughout's, the has killed 300 and infected more than 5,270.",3.200000047683716
2783,"The redesigned also features, coloured for customized of and and dynamic of the for, and.","It also supports coloured to better, and dynamic of the for, and.",3.0
2784,"The representing, did not respond to repeated.",with and did not respond to repeated from the seeking.,2.75
2785,"He was voluntarily castrated in 2001, an he contends removed his to become sexually aroused.",", who was voluntarily castrated in 2001, has said the took away his to become sexually aroused.",4.5
2786,"The & composite rose 87.74 on the, while the composite gained 44.49.","On the, the industrial rose 11.56, while the gained 39.42.",1.0
2787,In will license 2 while also formalising an existing to distribute's for running.,", Germany-based will license's 2 () and ship's across its.",3.75
2788,Long formed outside and rushed to get from as prepared to weather a that threatened to paralyze the.,Long formed outside and rushed to get from as braced for the's.,4.5
2789,"The tech-heavy composite fell 3.99, or 0.2, to 1,682.72, following a two-day of 55.93.","The technology-laced eased 8.52, or 0.51, to 1,670.21.",1.5
2790,"We don't know if any will be ,""said ,'s of public.","\"" We're being hyper-vigilant ,""said ,'s of public.",2.0
2791,"for the, rising 37 percent year-on-year to 1.76 billion.","rose 37 per to 1.76bn, beating.",4.0
2792,The said it would issue revised for the full fiscal next when it releases its.,The said it would renew its for 2003 when it announces its second in.,3.200000047683716
2793,"\"" We haven't decided whether to use an unbroken or dotted white, but this is an experiment ,""said, the's.","\"" We haven't decided whether to use an unbroken or dotted white ,""said, the's.",4.0
2794,after a 38-year that included in and of peacekeeping in.,'s included in and of peacekeeping in.,3.0
2795,The also sent and to the.,are being sent to the for.,3.25
2796,"\"" But that does not clear them of the to do possible to protect, and that is not what we're seeing . ''","\"" But that does not clear them of the to do possible to minimize civilian . ''",3.4000000953674316
2797,",'s, said he would attend the and would ask to speak on the.",",'s legal, said the would have no on the.",2.0
2798,Previously he had seen the grinning from east only on.,"had seen's on, the infamous of the grinning from east.",3.4000000953674316
2799,"Two later, the would begin.","Under the, for would begin in 2006.",2.799999952316284
2800,show that has been shrinking at the of nearly 10 a.,found that in the is disappearing at a of 9 each.,3.200000047683716
2801,"\"", if, may be safer than conventional because of all the ,""said, adding that 18 have adopted.","\"", if, may be safer than conventional because of all the ,""said ,'s executive.",3.200000047683716
2802,"A nationally certified teacher with a's, makes a of $65,000 in his 30th.","A nationally certified teacher with a's, , in his 30th, makes $65,000.",4.75
2803,"In, the said would accept the, although no had yet been set.","In, the said on had accepted's, but said no had yet been set.",3.25
2804,"The epidemic began in in the's, but the's of refused to report truthfully about its for four.","The epidemic began in in, but the refused to report truthfully about its for four.",4.25
2805,"will face, said.",said will be charged with.,5.0
2806,"That compared with $35.18 million, or 24 per, in the year-ago.",were affected by a non-recurring $8 million in the year-ago.,1.600000023841858
2807,", a from in, went to the with the seventh.","Next, took, a left-handed and from in.",3.799999952316284
2808,We remain hopeful that the will agree to work with us and engage in good-faith on this . '',said the``remains hopeful that the will continue to work with us and engage in good-faith . '',3.5
2809,Some are also concerned that so many are turning to cosmetic in a for bodily.,Some also express about a in which more than ever are turning to cosmetic in a for bodily.,4.75
2810,The was first reported by.,first reported the on.,3.0
2811,"There is, however, no of in the examined by the.","There is, however, no of in the of the examined by The.",3.0
2812,"\"" We continue to work with the on this, but they did not, as of the of this tragic, provide the additional we requested . ''","\"" But they did not, as of the of this particular tragic, provide the we had requested ,""said.",3.25
2813,A released by said would begin driving the on an interim beginning next in the at's.,"It was announced that will replace in the . 1, beginning with the at's next.",3.25
2814,"'s semifinal is, whom he beat in last's final.",will play next in a of last's final.,3.75
2815,have speculated that the's own against and improves.,Their was based on that cell and improves.,4.25
2816,"The technology-laced added 8.27, or 0.51, to 1,633.53.","The broader &'s 500 crept up 4.3, or 0.44, to 980.52.",1.2000000476837158
2817,"No were reported among the, according to ., a for the.","of the was, said . ,.",5.0
2818,We think they have the to choose.,"\"" We think PeopleSoft deserve the to choose ,""said.",3.0
2819,"\"" We have found the ,""investigating said.","\"" We have found the ,""said, of's in.",3.5999999046325684
2820,"\"" This was literally neglected to ,""said.",said the many in the did not include.,1.7999999523162842
2821,"said that it is halting of future of its, citing from's.","will stop developing of its for, saying that's is now all that.",4.0
2822,was not immediately arrested and is expected to appear for arraignment 3.,", who hasn't been arrested, is expected to appear for arraignment next, said.",3.799999952316284
2823,"raised a record-breaking $49.5 million for his over the last three, with from 262,000, the's said.","has raised $83.9 million since beginning his in, and has $70 million of that left to spend, his said.",2.4000000953674316
2824,"in, and have searched for the.","So far, also have searched in, ,, and.",2.799999952316284
2825,"He said European``have blocked all new because of unfounded, unscientific.","\"" They have blocked all new because of unfounded, unscientific ,""said.",3.200000047683716
2826,"One was whether, which infuriated by leading the against for the, would vote ``""or abstain.",", which infuriated by leading the against for the, also sought.",3.0
2827,"told a that were``continuing to make significant""in the.","No have been filed in those, but said were``continuing to make significant""in the.",3.4000000953674316
2828,The said its latest of hit 60 after falling to 53 in its first.,"The said its of, which had fallen to 53 in the first of 2003, improved to 60 in the most recent second.",3.799999952316284
2829,Its legal began meeting with' last to discuss a.,for both the archdiocese and the began meeting last to reach the out-of-court.,3.25
2830,"would then have to pay 50 of their costs up to $3,450.","Above that, would pay 90 of all.",1.5
2831,The flamboyant flagged the after a in with Australian.,was speaking after a in with Australian.,2.799999952316284
2832,"sold off sharply after told on that the``could very well be embarking on a of extended"".","told on the``could very well be embarking on a of sustained"".",3.200000047683716
2833,"For (), the means and.",() is desperate that her not find out that her has fallen apart.,2.0
2834,"The for's of nonmanufacturing rose unexpectedly in, said.",The for said its of non-manufacturing rose to 50.7 from 47.9 in.,3.4000000953674316
2835,"WHO agreed, saying:``It looks very much like an isolated . ''","\"" It looks very much like an isolated ,""said.",4.599999904632568
2836,said her two small were alone in the for up to two.,said her two small were alone there for up to two as she lay dead.,3.25
2837,"The, the . , 64, of 35th in, was charged with aggravated and criminal of a.","The . , 64, was charged with aggravated in the and with criminal of a, according to a.",3.75
2838,The includes $4.1 million in' and.,' would get $4.1 million of the.,4.5
2839,Three no would kill it for now.,It would take three to kill the's.,3.6670000553131104
2840,"Some 660 from 42, including, are held, many captured during the against in the al-Qaida.","Some 660 from 42 are being held at the Naval at, many captured during the against in.",3.3329999446868896
2841,"To reach, who covers, (816) 234-7743 or send e-mail to jdvorak.","To reach, municipal, (816) 234-7724 or send e-mail to bcooper.",1.0
2842,called the a for's.,of's were not present.,1.0
2843,"And now it's he wants to say ,"", and social, said this.","And now it's he wants to say ,""confirmed and social.",5.0
2844,"The national of the, with 2.3 million, is the of the 77 million-member.","The, with 2.3 million, is the American of the worldwide, which has 77 million.",5.0
2845,"\"" I feel confident saying that is no longer an ,""said.","\"" We still have a to do, but I feel confident that is no longer an . ''",3.4000000953674316
2846,British arrested 21 early in with the suspected ritual of an African whose was found in the.,have arrested 21 in with the of a young Nigerian whose and was found floating in the.,3.5
2847,"By late, the industrial was up 12.81, or 0.1, at 9,331.77, having gained 201 to its highest since 2002.","In, the industrial was down 8.76, or 0.1, at 9,310.20, having gained 201.",1.25
2848,pitched a perfect for his 23rd in as many.,struck out two in a perfect ninth for his 23rd.,3.25
2849,"closed on just below their 52-week high, at $32.17, up $1.54.","of's closed at a 52-week of $32.17, up $1.54.",3.25
2850,said her had received from senior that his would not be made public.,She told the that her had received from his and senior that when he came forward his would not be made public.,3.75
2851,"If convicted, they face up to five in and a $250,000 on each of the 11.","If convicted, each faces up to five in and a of $250,000 or more based on the of involved.",3.25
2852,corporate tightened in spotty on as labored to get back on its after the largest ever in.,"rose slightly on feather-light on, as regrouped after the biggest-ever in.",3.5999999046325684
2853,"went smoothly, although weren't told what was going on, said.","were evacuated smoothly, although they were not told what was going on, he said.",4.400000095367432
2854,"Between 1993 and 2002 , 142 of sexual were reported.","From 1993 to 2002, there were 142 reported sexual at the.",3.5999999046325684
2855,"said simply``Oh, my ,""in the afterward, according to.","In the after the, she added, said simply,``Oh my . ''",3.75
2856,said he expects will similarly be called as a at a pretrial for.,will be called as a in a pretrial for fellow.,2.5
2857,"\"" He really left us with a on his and no last ,""said.","\"" He really left us with a on his and no last...He gave us each a and that was it ,""she said.",3.25
2858,He also could be barred permanently from the.,"faces a fine, or being permanently barred from the.",3.3329999446868896
2859,"\"" They were an inspirational, and courageous ,""said the.","He said: They were an inspirational, and courageous.",3.0
2860,"A second, , 23, was struck in the, the perforating his.","The other, , of 550, was struck in the.",2.200000047683716
2861,"In an, , who is a, acknowledged that much of the among here and across the was wariness toward capital.","In an, , who is a, said many here and across the shared a toward capital.",4.599999904632568
2862,Judge-Executive said a was struck by lightning and was taken to the.,"A, was struck by lightning and was in stable at.",3.200000047683716
2863,". confirmed that another two had been arrested, one in and another in ,.",", a, confirmed that another two had been arrested, one in and another in ,.",5.0
2864,said he imposed the maximum because showed no in the brutal.,said he imposed the because showed no.,3.5999999046325684
2865,About 120 potential were being asked to complete a lengthy.,The were taken into the in of 40 and asked to fill out a.,3.200000047683716
2866,"Five alternate were also chosen, with a final to be selected from the.","Five alternate also were selected, with a sixth to be picked on.",4.599999904632568
2867,The did not immediately return seeking.,The did not immediately have an official to's.,3.799999952316284
2868,But the prime told the he wasn't bothered by and that he would continue to do what he believed to be right.,"He said he wasn't bothered by and that he would continue to do what he believed to be right, in both foreign and domestic.",3.4000000953674316
2869,heads a Combined based on in the of and the Indian.,heads a Combined aboard the.,3.5999999046325684
2870,"had expected 22 a, according to.",The were 3 a lower than the of surveyed by.,2.200000047683716
2871,The legal follows three of intense may be bidding for the.,The legal follows three of wild in's over that may be bidding for the.,3.5999999046325684
2872,The were published in the 1 of the of.,The are being published in the of.,3.799999952316284
2873,The could be taken up by the full as early as.,said he hopes to bring the two to the full by.,4.0
2874,declined to comment on the.,"\"" We think it's great ,""said.",1.7330000400543213
2875,think the from the of provide a more accurate of the because the are based on a larger.,The said they believe the provide a more accurate of the because they are based on a larger.,4.0
2876,The want her kept alive; her says she never wanted to be kept alive artificially.,has argued that his never wanted to be kept alive artificially.,2.799999952316284
2877,"Earlier, he told,``I think we can now qualify what is happening as a genuine . ''","\"" I think we can now qualify what is happening as a genuine ,""said on.",3.200000047683716
2878,", 39, is expected to die sometime in the next two in the where she has spent the past several.",", 39, underwent the at the where she has been living for several, said her ,.",1.7999999523162842
2879,"Prior to joining, worked for &, where he managed such as and.","Prior to joining, held senior for &.",3.75
2880,has been granted of three crucial of policing in the.,has been granted of three of by.,3.75
2881,with at could not be reached.,could not be reached for.,2.9089999198913574
2882,They said the was taken to for.,"The was taken to, where said he was``doing . ''",3.4000000953674316
2883,", a for, declined to comment.",A had no immediate.,3.5999999046325684
2884,The also staged a five-day in that forced all but one of's dining to close.,The also staged a five-day in; have preceded eight of the last 10.,2.5999999046325684
2885,". has said that while he opposes gambling, he would be reluctant to veto of the.",". opposes of gambling but has said he would be``hard-pressed""to veto the.",3.799999952316284
2886,"In, the composite was up 8.34, or 0.5, to 1,790.47.","The dipped 8.59, or 0.48, to 1,773.54.",1.600000023841858
2887,"In, faces.",": Republican, a three-term, is battling Democratic.",3.799999952316284
2888,"The fell 98.32, or about 1.1, to 9011.53.","The industrial finished the down 98.32 at 9,011.53.",3.4000000953674316
2889,"'s 401 () covered about 20,000, and.",'s comprised as much as 61 of the' 401 ().,2.5
2890,The judiciary overcame a significant in the to create a to pay of.,The judiciary on overcame a significant in the to create a to pay of but the most difficult remain.,3.75
2891,But she didn't say whether she'll certify the two-year $117.4 billion for 2004-05.,She said she didn't know yet whether she would certify the.,3.1670000553131104
2892,It would be difficult to overestimate the potential of the ().,"The involves the Remote (), which deals with inter-computer.",2.5
2893,"Although can increase the of, argue, so do and high.","Although can increase the of a of, argue, so do and high, which are not considered.",4.25
2894,during her 1-up over in the 27th's.,Now she has her first after in the's here on.,2.75
2895,"said the would also feature a 4.5-inch ,.",It also features a 4.5 in back-lit and.,2.75
2896,"At one of the three sampling at, the came back at 160 on 16 and at 120 on 23.",The came back at 160 on 16 and 120 at 23 at one of three sampling at.,3.25
2897,"Where used to catch 10 fish per 100 in past, they are now lucky to catch one, the found.","\"" long used to catch 10 fish per 100, now they are lucky to catch one ,""said.",4.199999809265137
2898,"was trading at $31.29 during, down 72 or 2.25.","was down 2.5, or 81, at $31.20 on the.",3.200000047683716
2899,But of the came on several.,And several are cranky about the.,2.75
2900,"As a, sought to substitute's, , as the.","said's, , was in the at the, but was not.",1.75
2901,"The from airing that promote, , or oppose a at any.","It upheld that bar the same from airing that promote, , or oppose a at any.",3.75
2902,pared to compensate for sluggish.,"In to sluggish, pared.",4.800000190734863
2903,"drafted outfielder, from in, with the fifth.","The chose, a high from who hit, with the fifth.",3.4000000953674316
2904,was down 0.8 against the at $1.5875.,The rose 0.15 against the Japanese to 115.97.,0.800000011920929
2905,"The industrial rose 41.61, or 0.44, to 9,415.82.","The rose 41.61, a of 0.4 for the and 0.7 for the.",4.0
2906,"\"" Right from the, we didn't want to see take a in.","But told The:``Right from the, we didn't want to see take a in.",4.0
2907,"\"" There were a of bureaucratic and administrative missed--there's not one who's responsible here ,""said.","In turning down the, said, ''there were a of bureaucratic and administrative missed here.",3.75
2908,did make one in - as a at the.,Convicted spoke out in to after registering as a at the.,3.25
2909,"At 5 ,'s was near latitude 25.6, longitude 93.7 west or about 280 east-southeast of.","At 11 a.m. ,'s was near latitude 18.1 north and longitude 53.2 west, or about 550 east of the.",1.25
2910,"On, a 149mph against equalled's.","On, equalled the with a 149 . serve in beating.",3.5
2911,"The broader &'s 500 .SPX climbed 10, or 1.10, to 943.","The jumped 43.64, or 2.89, to 1,553.73.",1.0
2912,settled .85 lower at 69.89 a.,heating ended down 0.41 to 70.74 a.,2.5
2913,confirmed that had tried to sell the during the.,"'s, , confirmed she tried to sell the in.",3.437999963760376
2914,said the indicated that the was``very methodical . '',said the showed that the was very methodical.,4.0
2915,"\"" This moves us a closer to saying that the can do this of ,""said, a of the.","\"" I think this moves us a closer toward saying that can do this of ,""said.",3.5999999046325684
2916,"\"" We had to do with's internal ,""said.","\"" had absolutely to do with's internal ,""said.",4.199999809265137
2917,"cast on an's that it may have found the of, one of the best-known.","think they may have identified the long-sought of, one of the ancient's legendary.",2.5999999046325684
2918,is to provide retail of all the to manage their online in a single.,The said wants to give retail of all the eventually to manage online in a single.,4.400000095367432
2919,"He was listed last in critical but stable at, said.","That, a, was in critical but stable at the.",3.25
2920,"The 30-year grew 1-3/32 for a of 4.30, down from 4.35 late.","At 11 (1500), the 10-year was up 11/32 for a of 3.36 from 3.40.",2.0
2921,"'s closed down $2.81, or 7.6, at $34.19.","'s closed at $34.19, down $2.81, or 7.6 on the.",4.5
2922,", speaking from the, said he questioned``the of a who assumes the of a for of a . ''","\"" But I do question the of a desk-bound who assumes the of a for the of a . ''",3.4000000953674316
2923,The of is facing a 20m from of who claim they were raped by British.,of claiming they were attacked and raped by British were granted legal to pursue their against the of.,3.0
2924,"of rose $2.28, or 7, to $34.96 on in composite and have gained 53 this.","of rose $6.03, or 41, to close at $20.72 on the.",1.0
2925,Similar passed the but died in the.,"Two ago, the passed a similar that floundered in the.",2.75
2926,The's affected third-quarter per by a.,The said this impacted by a a.,3.25
2927,"The was hospitalized 15, said.",said he had not been hospitalized and is recovering.,1.0
2928,edged lower by on as a of drained some of the that has driven a over the past three.,fell in early on as a of drained some of the that has driven a over the past three.,3.5999999046325684
2929,"The technology-laced tacked on 5.91, or 0.29, to 2,053.27.","The technology-focused advanced 6, or 0.30, to 2,053, erasing earlier.",3.200000047683716
2930,"Two and six with Jordanian were among the, the said.","They include two and six with Jordanian, and the are and, the said.",3.0
2931,"Her , 21, was declared a public and she attended a and a.","When his, then-Princess, turned 21 in 1947, the was declared a public, and she attended a and a.",3.200000047683716
