,sentence1,sentence2,label
580,"When the last of the died in 37, made of . With, (37-34 .) ruled on both of the . After his the Jewish was divided among his and gradually absorbed into the.",The.,1
581,", of's local accused, prime of and a of the, of trying to use his political to influence the by in into of industrial against.",was accused of helping.,0
582,The showed in advanced at a solid 8.9.,The was a disappointing.,1
583,"on disposed of its remaining and last non-UK retail with the 390m (265m) of the, , to, a private.",was based in the.,1
584,"shocked the in 1936 when he gave up his to marry an American ,.",King abdictated in 1936.,0
585,"He tried to persuade a local to more to the, but the refused, insisting they didn't qualify for . So, started his own to help the poorest of the poor themselves up.",started his own to to the.,0
586,"are permitted to enter the 6 later without as long as they have been treated for, and between 24 and 48 before boarding the that will return the to the.",is compulsory for to enter the.,1
587,"Though and his settled quickly in, it wasn't a successful for, and was allowed to leave in 1987 to join French outfit.",departed in 1987.,0
588,"Since '82 (elected by``constructive of no""against former, (); reelected 1983 , 1987 , 1991 and 1994). This makes the longest-serving of the, by, the first, this.",The of's political is the.,1
589,"is a of Malaysian transnational, One.",owns One.,1
590,"and prime ministerial are among whose are holding in the third . are due on 16 and no is expected to win a clear . in the of, , and, ,, ,, and are casting on . is also being held in the federally-administered of and, and and.",is winning in the.,1
591,"'s said that it still strongly discourages from using other than full, but that will be given if the``clearly shows the required ,""even if it contains text-speak.",is recommended by's.,0
592,"of fast have launched a legal over and for its, it emerged . The is being taken by the newly formed (), which also warned that current would lead to and due to labour . The represents 170 in the fast including, and's . It said it was to take a High to the of the () to set minimum and for in the.",The also includes's.,0
593,"As moves beyond the Floridian, have begun to surface . On, the official was seven dead, at least five missing . 4 in , 3 in . The for predicts that it will continue on its present northwesterly and the of and the delta in the next few.",hit.,0
594,The 2002 will take from 8th to 24th 2002 . The will take in from 7th to 16th 2002.,2002 take in.,0
595,", 22 ()--Anibal, a former prime, won's presidential on.",prime is elected.,1
596,"Practically every of international has vied for the of public and private--including, ,, , and.",is an.,0
597,"Whilst the has an absolute in the Australian, it is not guaranteed that the necessary will pass this . Garnering the of key is critical to ensure that the will pass (as he will have the deciding) and he has already stated that, due to a damning released earlier in the of showing that fourteen of were faulty other, that it has turned the``green to amber""[ 1.",is an Australian.,0
598,"The six-member included from the, , and, according to military, who spoke on of because only was allowed to officially disclose the . They were to spend a of one with each of the (), who are of's and who risk religious if returned to their . Each was captured in in late 2001 and handed over to, who interrogated them to learn about's paramilitary.",Six were captured to gain about.,1
599,"Though owning no and no, has become the of a bitter political between and.",There is a territorial dispute.,1
600,"After graduating in 1977, chose to accept a full to play for.",attended.,0
601,"For who are negative or who do not know their, breastfeeding should be protected, promoted and supported for six.","For HIV-positive, the about whether or not to breastfeed a can be difficult.",1
602,"The of the, which carried astronaut ``""on a brief suborbital on 21 , 1961, took on the 30th of's first.",The was first touched by in 1969.,1
603,"The found that many through the, , legal and because of their mental, , skin, , sexual or.",Mental increase in the young.,1
604,pay of a to come and see's and pay more in strictly illegal of and from.,African encourage keeping alive to attract.,1
605,"served longer as than in a, and his 33-year as a was among the half-dozen in the's.","served the second-longest, as chief, in.",1
606,"The is thought to have no magnetic . It has the which raises the about 5 . It has a very thin atmosphere consisting of 95.3 , 2.7 , 1.6 , 0.15, and 0.03.",is called the red.,1
607,"When of how was executed and put on public, he vowed he would not let this happen to him . shot his and new, , and then swallowing some, he shot himself in the.",'s was.,1
608,", along with top of the of, along with will announce the of a $9 billion to fund's.",is a of the of.,1
609,"also starred in several after the including where she played the of and song and! Or My where she also played the of . She also starred in the spin off of The titled The and made a two on another off called . was born in on 25 , 1923, passing away just three before her 85th.",played's.,1
610,"Strong in such as has resulted in of in labour saving such as and, processing and welding.",The automotive has seen in robotic.,1
611,Cuban sent a to assuring him that will follow in the of last's terrorist against and.,visits the.,1
612,"\"" We've never had a (),""told at the this of, which, with and, are his latest bright.",'s is called.,0
613,", best known for his as, is paralyzed and cannot breathe without the of a after breaking his in a riding in, , on.",had an.,0
614,"One on since he was elected to as of, is making in the he leads, but for all the wrong . and have been dominated by of coming forward to claim they had a with the former . This``political"", complained one of these, is``paralysing the"". Three have made so far and there were in the that there may be more to come.",was a.,0
615,"The in, sits 443ft over the . It has attracted more than 27 million since its formal on 31 , 1999 . Each is set to be air-conditioned and hold up to 30 . Three possible for the to sit have been selected . This is not the first by the to bring into the . The are seeking for a . The would include a six and a 18 hole.",The flows through.,0
616,are poorly trained for.,are poorly represented in.,1
617,"About two before the started, I was in's in.",works in.,0
618,"The European for () said on that repairing the () will cost up to €16.6 million or $21 million . The, which is the's largest and highest-energy, is located near the of and and crosses the four . It has a of 27 (17). It is designed to simulate the shortly after the, but it broke down on 19 due to an electrical.",is in.,1
619,"The donated one of the's most significant private of, , to the's of.",gave the a of sought-after African.,0
620,has now firm which include a in a joint called in involving the's main.,acquired three Russian.,1
621,"to British, whose won 13 ago and who is the current, said the acknowledged jointly - and without trying to blame each other - that the's Belgian-based is regarded as both remote and overbearing.",belongs to the.,0
622,"A Spanish who murdered a with a on the of has been jailed for 39 by a in the . and were bludgeoned to by tenant , 42, when they tried to collect overdue from him in 2006 . was sentenced to 17 for's and 22 for the more``brutal""of her . He was ordered to pay their in a private.",was killed by and.,1
623,", of the, the most senior serving in the, said that ``...the came into at very low . Both remained safe . No occurred . We can confirm the remains unaffected and there was no to nuclear .""`` Both want quiet, deep, roughly the same from their . So you find these have got quite a few, not only French and but also from and the . often used the same nesting ,""said, an independent nuclear and primarily known for his in assessing and reporting upon nuclear and nuclear related and.",Two have collided.,0
624,"By, can only export half the it produces to the.",produces more than any other.,1
625,The for a green has risen from 21 to 33 in those same.,It takes longer to get green.,0
626,", the, will meet his Brazilian, , in.",is a of.,1
627,"The, which had been cited for numerous last, made and.",The had been cited for numerous last.,0
628,"If confirmed as, the could be the first of the acquired in the since 1902.",A of was confirmed.,1
629,"countered, telling The, the is that from which is 1,800 to the of traveled to and contaminated, , and various of the . And they might as well have said that it was equally unfeasible for it to travel that in the opposite to the general of the, but we have examined of over the of the and its clear the from could have come through the because of the particular of and that were there.",The had outside the.,0
630,"was only slightly put out to find that are as poorly represented among Australian political as they are in (was asking, 'where are all the?').",are poorly represented in.,0
631,"Canadian licensing has begun legal against, alleging the's and are making of its intellectual without.",and begin legal against a Canadian.,1
632,Actual about the deterrent of capital are not available because it is impossible to know who may have been deterred from committing a.,is a to.,1
633,"\"" If we could put a on the within back in the 1960s, I think we can eliminate if we develop the will to do so""said, who called for a significant for the, particularly the large necessary to demonstrate.",The was first touched by in 1969.,1
634,"had built the for his on 28th off, as he lives nearby.",lives on 28th.,1
635,and announced an to restore full diplomatic nearly eight after they fought a 74-day over the.,diplomatic were re-established in 1990.,1
636,", a of, is accused of posing as a potential on 26, then forcing himself inside the and raping a 19-year-old.",bought a in.,1
637,"In the 1970s, she was one of the most popular in, and became well-known internationally ., from in the of, parlayed her initial from playing in the French of into taking the``grand""at the in 1973 . Her, ``""( You will recognize yourself), became a Europe-wide that.",won the.,0
638,"In, are obliged by to register all except those bought at a public.","In, works of bought at public are exempt from.",0
639,"Twenty-four, among them seven, were killed on after their crashed in a in . Four survived the, including a 9-year-old . The, which was a twin-engine chartered by, was carrying 26 and two when it crashed . The of the, which had departed from, had supposedly contacted the near their of to announce that they were turning back . The, however, then disappeared from . The made an in the, a the in the Brazilian of , 50 (80) from.",24 died in an.,0
640,"A young known as has been jailed for for the of a promising . , 20, shot dead in 2007 as he tried to flee the in the, , north ., from, east, who was convicted of the's earlier this, was sentenced to a of 26 at . He sat as was passed.","\""""is the of.",0
641,"Some large Russian, including, , the state-owned, and, the, were implicated by the.",in.,0
642,Some of the stolen were seized from the at the () while they were attempting to fly to.,were stolen.,0
643,certified organic including liquid and.,Organic are used as.,1
644,"The optimal of is specific to the particular, the of the geophysical (, 2005) as well as social, the undertaking, the operational of many of and, the situational and the of its required compositional.",life-threatening.,1
645,"Earlier this, , chief of, floated the that might be sold.",sold.,1
646,"For a western European, the in is high.",is the European with the highest.,1
647,", packing winds up to 170 (106) and the strongest on to enter the in, made between the of and and was advancing, the said.",A batters the.,1
648,The two who retrieved him are with a California-based: . of and of.,A is based in.,0
649,"The came amid recent by' that the engaged in``an elaborate""to keep quiet the of child sexual by.",The claimed that the archdiocese engaged in a.,0
650,"At approximately 3:20, an unnamed reported of the on a near , 27th, causing to create a, surrounding the . This is where the other two were shot, this in an of while attempting to take the alleged of the two into . The was killed by . The was, aged 26, who had a issued for his after his was revoked for of . All four of the were taken to in critical where they all later died of their . There were: Sargent, aged 43, , 35, aged 41 and , 40.",Sargent was a of.,0
651,The being held captive by are expected to be freed.,British detained,0
652,"A male is called a and a female is called a, just like.",A female is called a.,0
653,"A that president-elect is has got more than 600,000 on sharing, with many of those coming after he was elected on 4 . ``, , and, There's no as Irish as ,""states the .``You don't believe me, I hear you say . But's as Irish, as was . His's came from, a small Irish, well known to you all"".","According to a, is Irish.",0
654,"On in the of in, , claimed that they had seen a in the, the Turkish . They said that the was glowing with white and that it revolved around itself . has had previous in the, and in 2002, the was opened to the.",A might have been seen in.,0
655,"A massive is under in more than 20 of and, but in has forced a of the, the () announced 18.",is under in the.,1
656,"In the since the Chinese began repressing, a that human say has led to the of of of and claimed at least 2,000, the's has shifted elsewhere . The against the spiritual has eliminated its, decimated the of and convinced many Chinese that the is an``evil ,""as the contends . But 10 on, the on remains unfinished.",is a spiritual.,0
657,"A four-day of has been declared in the of, after violent occurred after of and in's . that 5 have been killed, and over 300 injured . The injured were and alike, suffering from, , and stoning . Among the injured was a Japanese, who was reportedly flown to in the.",300 were killed in.,1
658,"has received short in . Yet in recent, significant public has taken in on the joint U.S./Colombian and its on and its.",debates border with.,1
659,"was seriously wounded by a fired by in an attempted, but made a remarkably speedy.",survived an attempted's.,0
660,"With more than 223,000 already in, said at, around the, say they are running out of.","With more than 220,000 in, warned that his was running out of.",0
661,"The is named after, a and who invented in 1866 . left much of his to establish the, which has honoured in, ,, and to promote since 1901.",invented dynamite in 1866.,0
662,put their into the to avoid the.,bury their in the.,0
663,"has done it all - almost . He's hosted the, danced on, flashed his winning and flexed his, but is the first the Australian will claw his into as the main . In``X-Men: ,""there's no or by his to buoy the . This it's just, his and a of to the of $150 million.",will play the magician.,1
664,"\"" The rapidly mixed of former have been sent to the with no, , or any formal, increasing the of future human ,""said in a . Among the former integrated into the regular are, who was recently promoted to the of general . He is wanted on an by the for enlisting and is accused of commanding the troops that massacred 150 in the of last.",is a general.,0
665,"The 84-year-old was wheeled to a, and blessed the by making the of the in clear, as a snapped.",The made the of the.,0
666,", 54, used a controversial to commit in.",An was in for an assisted.,1
667,"The, which won him for four, was regarding the and of the top, an elementary discovered in 1995.",The is the last of six of predicted by the standard of.,1
668,"The this new was driven in from a of transport-related in the late, such as the of the of in 1987, the in 1988, and the in 1989 . More than 400 lost their in these three, but no one or was brought to account.",100 or more lost their in a.,1
669,", the of, plans to step down as chief and.",quits ceo.,0
670,"As gather in ahead of this weekends regional, ,'s populist is using an to win and promote his of 21st-century.",acts as's.,0
671,Al-Qaida-linked have carried out a of suicide targeting Western in since 2002.,Since 2002 Al-Qaida have tried to hit Western in.,0
672,"is to compensate who suffered as a of three of nuclear, its says . It was to investigate reported by who took in, said . told should be``true to its"". carried out more than 200, firstly in and later in French, between 1966 and 1996 . said about 150,000 civil and military were``theoretically affected""by the . said an independent would examine on a case-by-case . He added that 10m ($ 13.6m ;) had already been earmarked to compensate.",carried out more than 200 nuclear during 30.,0
673,"Although he won with the lowest ever tallied by the ruling , 48.7 of the, his almost doubled those of de, the rightist . And are now favored to win other Latin American in the coming: In, , a former and, is expected to finish ahead of (), a leftist former, in the first of.",is a Brazilian former and.,0
674,in and use to extract the precious.,is used in.,0
675,"also claimed that the killed, a religious in the southeastern of.",lived in the southeastern of.,0
676,"\"" The were less in the past two, but they seem to be starting again . We are really worried about the of these ,""of, in the, told by.",is a of.,0
677,"Budapest of two, and, which are situated on opposite of the and connected by a of.",Budapest of two principal that were merged in 1873.,1
678,"The, owned by . and flagged in the, came under at around 4 () as came from two small . The, with a of from the, suffered light to its and were broken . The was en-route from, to, . The 126.75m had loaded with 377 used in on 17.",is the of the.,1
679,"continued buying fewer and at in its second and led to a 77 in net, but the in was of an . - in recent by the that its are too pricey - said that at established fell 8 both and in the the first three of 2009 compared with a earlier . In the last three of last ,' global fell 9 and same-store declined 10.",is a US.,1
680,"controls an of about 850 square in the of the, while has about 30 over two of the Lebanese.","has 30,000 in 60 of, and controls an in the of 850 square.",0
681,"has decided to remain with her twin sister, , instead of going on a planned to to promote the of the' latest``,""reports the.",plans a to with.,1
682,"The privately owned only got about 400 into, according to, but it was enough to confirm that it no longer takes a well-heeled to organize.",private,0
683,was elected 28 with a to reform's and pull the out of.,The Italian is.,0
684,"Although the of the confirmed has risen slightly to 26 in and to 16 in, new are now so low that it seems the is``burning out"".",breaks out in.,1
685,"According to done by an anti-spam, the is the of of over 42 of all . Trailing are with 13 and with 8 of the's . The performed an of its to come up with the ―a is a special set up to attract or in to gauge . Such is not entirely unexpected . The for slightly over 25 of all, whereas and have about 4 and 11 of the's, respectively . Yet these still point to the as being a for.",The produces.,0
686,"\""""is most common among . They generally grow out of it once other such as and become available to them . have been known to start``glue"". Because of the social attached to``glue sniffing""most stop around 16 or 17, unless they are seriously addicted.",is common among.,0
687,"'s held with British in on, reassuring his that will hold a fair next and is ready to continue a sustained against and . The has been widely called's``charm .""The has held in, , at the in, and now in in an which has been seen as an to shore up European for his.",met in.,0
688,"The is twinned with, ,, and.",is twinned with.,1
689,"This, however, the has taken on a new as the, moving to block the's to build a nuclear, has rekindled some of the in's of the.",is the of.,1
690,", the of the political which overran's last, is in after a wielding an AK-47 ambushed his at a and sprayed it with early this . The unknown of shot out the of the owned by, the of the's for', and riddled the with . also hit a nearby public.",has been hit by more than 100.,1
691,The split with to feel OK about after last's 5-4 to the.,lose first ever at,1
692,"The emerged in 1992, and it is comprised of old from.",'s was set up by old in 1992.,0
693,"' whole was based in and revolved around her legal, her and an to an evangelical that led her to what her former described as a of late in.",was a of an evangelical.,1
694,announced that it plans to build a in to produce by late 1993.,in.,1
695,"Yes, is a critical of in the Arab-Israeli; but given the current of, and given the general among and, such are excitable of.",There is a territorial dispute.,1
696,"The of the 15th, scheduled for next in, , on responded to press that a prominent in discriminated against HIV-positive attending a different this.",HIV-positive take in the 15th.,1
697,"A of real-life by, one of's most performed, its less in the conventional of the than in what it reveals - a still deeply at with itself, a of that flatters neither, neither Western nor the former.",is a German.,0
698,"The (), one of the main in the, has broken an all-time, to close at 14,000.41 which is up 82.19 (0.59) from its last close . Just 59 before, the hit an all-time when it passed 13,000 . This is the first the has ever closed above 14,000 since its on 26 , 1896.",The has gained.,0
699,"It is the's aging nuclear that currently concerns Armenian environmental as well as those in neighboring . west of the ,'s was built in 1970s and two VVER-440 nuclear ., which currently produces about 40 of the's, is located in a seismically active and was closed even before the 1991 of the because of the devastating 7 , 1988, in.",nuclear was shut down after the 1988 Armenian.,0
700,"has won the 12th Presidential of the of, becoming the first of the second most populous in the . , 72, previously of the of, had from the governing . She won approximately two of the, almost double the of of her nearest rival, who resigned as after losing the.",has a female.,1
701,"In they filed with the for the of, argued that three who committed suicide last by hanging themselves coordinated their by using attorney-client to communicate with each other . said that among marked ``""were on how to tie and a classified on and inmate.",Three committed in.,0
702,"The's fast-growing for can only be met by purifying as and reservoirs become unable to meet, said last unveiling a major to fight its own chronic.",The is used for.,1
703,"The is a popular for to stay and a prominent in the, despite a of the . The had been of another in 2007 where a was killed and several injured after the blocked a from getting at the, forcing him to detonate his where he was.",There is a in.,1
704,This is one of the first to be prosecuted under a new regulating unwanted.,There is a new that bans.,1
705,"is a big of ``""( who was born on the fictional) and was to play the in a planned for the 1990s that never came to be.",played.,1
706,The German-based say their is the only of prolonged in a tropical.,The hibernating in.,1
707,"Nine and two were killed in the ensuing gun, and two were wounded, the said.","and two were killed in a, said.",1
708,"will hold the first presidential in its, between and's hard-line, said.","will face's hard-line in's first presidential ever, said.",0
709,is recongized as having been one of the foremost of the modern.,was an.,0
710,"\"" The is now pleased that can vigorously pursue a of the and how to extricate our from it . Speaking seriously, I'll take this of as a sobering that all of us, wherever we stand on the liberal-conservative, are deeply concerned about the damaging of the and are looking for to work together to resolve it as soon as possible . ''",All are deeply concerned about the of the and are looking for to resolve it.,0
711,"To the of rises the higher (771), a steep overlooking the, which provides a panoramic of the whole.","To the is, which features the 19th-century.",1
712,", the Prize-winning whose most famous fictional, in of a' came to symbolize the American gone awry, has died.",", the of of a', has died.",0
713,got a after an in's said the was benefiting from soaring natural and the of new that emit less.,.,0
714,"of the top, if confirmed, completes one of subatomic whose is predicted by the, called the, of the and that determine the fundamental of and . In the whimsical of modern, the elementary are called, and.",",, and are the three elementary of according to the.",0
715,"'s hard-line on the has grown considerably tougher in recent . with nose-dived after met with the in 2007, recovering only after offered a similar to that made by on . alleged to have supported the' have been subjected to smear and in, and an in by the British was axed by last because and chief once took in a free in 1997.",is a.,1
716,"- A that injured six in eastern, was followed by a near a, , that hurt two and a civilian.",The six were in.,1
717,"was a tropical when she entered, but caused to 75 of the, making it one of the costliest in's.",A tropical has caused significant or of.,0
718,It has become increasingly clear that is making rapid toward attaining a nuclear as have confirmed the of various nuclear that has failed to disclose,Iranian threaten.,1
719,"becomes the fourth where as well as can vote in . holds strictly limited, male-only.",can vote in in.,1
720,"In, confirmed that all North Korean on had started referring to as``His""or by the previously reserved for his,``the Great .""Until now, the younger has been called``the . ''",'s is called.,1
721,The has confirmed it has pulled out of the for rival the.,Daily is sold.,1
